MATCHUP,GAME_ID,SEASON,GAME_DATE,HOME_TEAM_NICKNAME,HOME_TEAM_ID,AWAY_TEAM_NICKNAME,AWAY_TEAM_ID
04/10/2018 76ers at Hawks,21701214,2017-18,2018-04-10, Hawks,1610612737, 76ers,1610612755
04/08/2018 Hawks at Celtics,21701202,2017-18,2018-04-08, Celtics,1610612738, Hawks,1610612737
04/06/2018 Hawks at Wizards,21701184,2017-18,2018-04-06, Wizards,1610612764, Hawks,1610612737
04/04/2018 Heat at Hawks,21701172,2017-18,2018-04-04, Hawks,1610612737, Heat,1610612748
04/03/2018 Hawks at Heat,21701158,2017-18,2018-04-03, Heat,1610612748, Hawks,1610612737
04/01/2018 Magic at Hawks,21701147,2017-18,2018-04-01, Hawks,1610612737, Magic,1610612753
03/30/2018 76ers at Hawks,21701130,2017-18,2018-03-30, Hawks,1610612737, 76ers,1610612755
03/28/2018 Hawks at Timberwolves,21701120,2017-18,2018-03-28, Timberwolves,1610612750, Hawks,1610612737
03/25/2018 Hawks at Rockets,21701101,2017-18,2018-03-25, Rockets,1610612745, Hawks,1610612737
03/23/2018 Hawks at Warriors,21701087,2017-18,2018-03-23, Warriors,1610612744, Hawks,1610612737
03/22/2018 Hawks at Kings,21701077,2017-18,2018-03-22, Kings,1610612758, Hawks,1610612737
03/20/2018 Hawks at Jazz,21701062,2017-18,2018-03-20, Jazz,1610612762, Hawks,1610612737
03/17/2018 Hawks at Bucks,21701041,2017-18,2018-03-17, Bucks,1610612749, Hawks,1610612737
03/15/2018 Hornets at Hawks,21701021,2017-18,2018-03-15, Hawks,1610612737, Hornets,1610612766
03/13/2018 Thunder at Hawks,21701007,2017-18,2018-03-13, Hawks,1610612737, Thunder,1610612760
03/11/2018 Bulls at Hawks,21700993,2017-18,2018-03-11, Hawks,1610612737, Bulls,1610612741
03/09/2018 Hawks at Pacers,21700978,2017-18,2018-03-09, Pacers,1610612754, Hawks,1610612737
03/06/2018 Hawks at Raptors,21700958,2017-18,2018-03-06, Raptors,1610612761, Hawks,1610612737
03/04/2018 Suns at Hawks,21700943,2017-18,2018-03-04, Hawks,1610612737, Suns,1610612756
03/02/2018 Warriors at Hawks,21700928,2017-18,2018-03-02, Hawks,1610612737, Warriors,1610612744
02/28/2018 Pacers at Hawks,21700915,2017-18,2018-02-28, Hawks,1610612737, Pacers,1610612754
02/26/2018 Lakers at Hawks,21700897,2017-18,2018-02-26, Hawks,1610612737, Lakers,1610612747
02/23/2018 Hawks at Pacers,21700874,2017-18,2018-02-23, Pacers,1610612754, Hawks,1610612737
02/14/2018 Hawks at Pistons,21700853,2017-18,2018-02-14, Pistons,1610612765, Hawks,1610612737
02/13/2018 Hawks at Bucks,21700848,2017-18,2018-02-13, Bucks,1610612749, Hawks,1610612737
02/11/2018 Pistons at Hawks,21700834,2017-18,2018-02-11, Hawks,1610612737, Pistons,1610612765
02/09/2018 Cavaliers at Hawks,21700819,2017-18,2018-02-09, Hawks,1610612737, Cavaliers,1610612739
02/08/2018 Hawks at Magic,21700811,2017-18,2018-02-08, Magic,1610612753, Hawks,1610612737
02/06/2018 Grizzlies at Hawks,21700799,2017-18,2018-02-06, Hawks,1610612737, Grizzlies,1610612763
02/04/2018 Hawks at Knicks,21700786,2017-18,2018-02-04, Knicks,1610612752, Hawks,1610612737
02/02/2018 Hawks at Celtics,21700767,2017-18,2018-02-02, Celtics,1610612738, Hawks,1610612737
01/31/2018 Hornets at Hawks,21700755,2017-18,2018-01-31, Hawks,1610612737, Hornets,1610612766
01/29/2018 Timberwolves at Hawks,21700739,2017-18,2018-01-29, Hawks,1610612737, Timberwolves,1610612750
01/27/2018 Wizards at Hawks,21700726,2017-18,2018-01-27, Hawks,1610612737, Wizards,1610612764
01/26/2018 Hawks at Hornets,21700714,2017-18,2018-01-26, Hornets,1610612766, Hawks,1610612737
01/24/2018 Raptors at Hawks,21700705,2017-18,2018-01-24, Hawks,1610612737, Raptors,1610612761
01/22/2018 Jazz at Hawks,21700688,2017-18,2018-01-22, Hawks,1610612737, Jazz,1610612762
01/20/2018 Bulls at Hawks,21700675,2017-18,2018-01-20, Hawks,1610612737, Bulls,1610612741
01/17/2018 Pelicans at Hawks,21700654,2017-18,2018-01-17, Hawks,1610612737, Pelicans,1610612740
01/15/2018 Spurs at Hawks,21700641,2017-18,2018-01-15, Hawks,1610612737, Spurs,1610612759
01/12/2018 Nets at Hawks,21700621,2017-18,2018-01-12, Hawks,1610612737, Nets,1610612751
01/10/2018 Hawks at Nuggets,21700612,2017-18,2018-01-10, Nuggets,1610612743, Hawks,1610612737
01/08/2018 Hawks at Clippers,21700598,2017-18,2018-01-08, Clippers,1610612746, Hawks,1610612737
01/07/2018 Hawks at Lakers,21700590,2017-18,2018-01-07, Lakers,1610612747, Hawks,1610612737
01/05/2018 Hawks at Trail Blazers,21700576,2017-18,2018-01-05, Trail Blazers,1610612757, Hawks,1610612737
01/02/2018 Hawks at Suns,21700551,2017-18,2018-01-02, Suns,1610612756, Hawks,1610612737
12/30/2017 Trail Blazers at Hawks,21700533,2017-18,2017-12-30, Hawks,1610612737, Trail Blazers,1610612757
12/29/2017 Hawks at Raptors,21700522,2017-18,2017-12-29, Raptors,1610612761, Hawks,1610612737
12/27/2017 Wizards at Hawks,21700508,2017-18,2017-12-27, Hawks,1610612737, Wizards,1610612764
12/23/2017 Mavericks at Hawks,21700484,2017-18,2017-12-23, Hawks,1610612737, Mavericks,1610612742
12/22/2017 Hawks at Thunder,21700477,2017-18,2017-12-22, Thunder,1610612760, Hawks,1610612737
12/20/2017 Pacers at Hawks,21700455,2017-18,2017-12-20, Hawks,1610612737, Pacers,1610612754
12/18/2017 Heat at Hawks,21700443,2017-18,2017-12-18, Hawks,1610612737, Heat,1610612748
12/15/2017 Hawks at Grizzlies,21700425,2017-18,2017-12-15, Grizzlies,1610612763, Hawks,1610612737
12/14/2017 Pistons at Hawks,21700413,2017-18,2017-12-14, Hawks,1610612737, Pistons,1610612765
12/12/2017 Hawks at Cavaliers,21700397,2017-18,2017-12-12, Cavaliers,1610612739, Hawks,1610612737
12/10/2017 Hawks at Knicks,21700390,2017-18,2017-12-10, Knicks,1610612752, Hawks,1610612737
12/09/2017 Magic at Hawks,21700378,2017-18,2017-12-09, Hawks,1610612737, Magic,1610612753
12/06/2017 Hawks at Magic,21700355,2017-18,2017-12-06, Magic,1610612753, Hawks,1610612737
12/04/2017 Nets at Hawks,21700342,2017-18,2017-12-04, Hawks,1610612737, Nets,1610612751
12/02/2017 Hawks at Nets,21700328,2017-18,2017-12-02, Nets,1610612751, Hawks,1610612737
11/30/2017 Cavaliers at Hawks,21700313,2017-18,2017-11-30, Hawks,1610612737, Cavaliers,1610612739
11/25/2017 Raptors at Hawks,21700280,2017-18,2017-11-25, Hawks,1610612737, Raptors,1610612761
11/24/2017 Knicks at Hawks,21700268,2017-18,2017-11-24, Hawks,1610612737, Knicks,1610612752
11/22/2017 Clippers at Hawks,21700256,2017-18,2017-11-22, Hawks,1610612737, Clippers,1610612746
11/20/2017 Hawks at Spurs,21700250,2017-18,2017-11-20, Spurs,1610612759, Hawks,1610612737
11/18/2017 Celtics at Hawks,21700230,2017-18,2017-11-18, Hawks,1610612737, Celtics,1610612738
11/15/2017 Kings at Hawks,21700204,2017-18,2017-11-15, Hawks,1610612737, Kings,1610612758
11/13/2017 Hawks at Pelicans,21700195,2017-18,2017-11-13, Pelicans,1610612740, Hawks,1610612737
11/11/2017 Hawks at Wizards,21700177,2017-18,2017-11-11, Wizards,1610612764, Hawks,1610612737
11/10/2017 Hawks at Pistons,21700169,2017-18,2017-11-10, Pistons,1610612765, Hawks,1610612737
11/06/2017 Celtics at Hawks,21700146,2017-18,2017-11-06, Hawks,1610612737, Celtics,1610612738
11/05/2017 Hawks at Cavaliers,21700136,2017-18,2017-11-05, Cavaliers,1610612739, Hawks,1610612737
11/03/2017 Rockets at Hawks,21700123,2017-18,2017-11-03, Hawks,1610612737, Rockets,1610612745
11/01/2017 Hawks at 76ers,21700107,2017-18,2017-11-01, 76ers,1610612755, Hawks,1610612737
10/29/2017 Bucks at Hawks,21700085,2017-18,2017-10-29, Hawks,1610612737, Bucks,1610612749
10/27/2017 Nuggets at Hawks,21700072,2017-18,2017-10-27, Hawks,1610612737, Nuggets,1610612743
10/26/2017 Hawks at Bulls,21700065,2017-18,2017-10-26, Bulls,1610612741, Hawks,1610612737
10/23/2017 Hawks at Heat,21700042,2017-18,2017-10-23, Heat,1610612748, Hawks,1610612737
10/22/2017 Hawks at Nets,21700038,2017-18,2017-10-22, Nets,1610612751, Hawks,1610612737
10/20/2017 Hawks at Hornets,21700017,2017-18,2017-10-20, Hornets,1610612766, Hawks,1610612737
10/18/2017 Hawks at Mavericks,21700009,2017-18,2017-10-18, Mavericks,1610612742, Hawks,1610612737
04/11/2018 Nets at Celtics,21701219,2017-18,2018-04-11, Celtics,1610612738, Nets,1610612751
04/10/2018 Celtics at Wizards,21701215,2017-18,2018-04-10, Wizards,1610612764, Celtics,1610612738
04/06/2018 Bulls at Celtics,21701185,2017-18,2018-04-06, Celtics,1610612738, Bulls,1610612741
04/04/2018 Celtics at Raptors,21701171,2017-18,2018-04-04, Raptors,1610612761, Celtics,1610612738
04/03/2018 Celtics at Bucks,21701162,2017-18,2018-04-03, Bucks,1610612749, Celtics,1610612738
03/31/2018 Raptors at Celtics,21701140,2017-18,2018-03-31, Celtics,1610612738, Raptors,1610612761
03/28/2018 Celtics at Jazz,21701121,2017-18,2018-03-28, Jazz,1610612762, Celtics,1610612738
03/26/2018 Celtics at Suns,21701107,2017-18,2018-03-26, Suns,1610612756, Celtics,1610612738
03/25/2018 Celtics at Kings,21701099,2017-18,2018-03-25, Kings,1610612758, Celtics,1610612738
03/23/2018 Celtics at Trail Blazers,21701086,2017-18,2018-03-23, Trail Blazers,1610612757, Celtics,1610612738
03/20/2018 Thunder at Celtics,21701059,2017-18,2018-03-20, Celtics,1610612738, Thunder,1610612760
03/18/2018 Celtics at Pelicans,21701047,2017-18,2018-03-18, Pelicans,1610612740, Celtics,1610612738
03/16/2018 Celtics at Magic,21701029,2017-18,2018-03-16, Magic,1610612753, Celtics,1610612738
03/14/2018 Wizards at Celtics,21701017,2017-18,2018-03-14, Celtics,1610612738, Wizards,1610612764
03/11/2018 Pacers at Celtics,21700998,2017-18,2018-03-11, Celtics,1610612738, Pacers,1610612754
03/08/2018 Celtics at Timberwolves,21700974,2017-18,2018-03-08, Timberwolves,1610612750, Celtics,1610612738
03/05/2018 Celtics at Bulls,21700953,2017-18,2018-03-05, Bulls,1610612741, Celtics,1610612738
03/03/2018 Celtics at Rockets,21700939,2017-18,2018-03-03, Rockets,1610612745, Celtics,1610612738
02/28/2018 Hornets at Celtics,21700916,2017-18,2018-02-28, Celtics,1610612738, Hornets,1610612766
02/26/2018 Grizzlies at Celtics,21700898,2017-18,2018-02-26, Celtics,1610612738, Grizzlies,1610612763
02/24/2018 Celtics at Knicks,21700886,2017-18,2018-02-24, Knicks,1610612752, Celtics,1610612738
02/23/2018 Celtics at Pistons,21700873,2017-18,2018-02-23, Pistons,1610612765, Celtics,1610612738
02/14/2018 Clippers at Celtics,21700858,2017-18,2018-02-14, Celtics,1610612738, Clippers,1610612746
02/11/2018 Cavaliers at Celtics,21700835,2017-18,2018-02-11, Celtics,1610612738, Cavaliers,1610612739
02/09/2018 Pacers at Celtics,21700820,2017-18,2018-02-09, Celtics,1610612738, Pacers,1610612754
02/08/2018 Celtics at Wizards,21700813,2017-18,2018-02-08, Wizards,1610612764, Celtics,1610612738
02/06/2018 Celtics at Raptors,21700798,2017-18,2018-02-06, Raptors,1610612761, Celtics,1610612738
02/04/2018 Trail Blazers at Celtics,21700784,2017-18,2018-02-04, Celtics,1610612738, Trail Blazers,1610612757
01/31/2018 Knicks at Celtics,21700758,2017-18,2018-01-31, Celtics,1610612738, Knicks,1610612752
01/29/2018 Celtics at Nuggets,21700743,2017-18,2018-01-29, Nuggets,1610612743, Celtics,1610612738
01/27/2018 Celtics at Warriors,21700728,2017-18,2018-01-27, Warriors,1610612744, Celtics,1610612738
01/24/2018 Celtics at Clippers,21700709,2017-18,2018-01-24, Clippers,1610612746, Celtics,1610612738
01/23/2018 Celtics at Lakers,21700700,2017-18,2018-01-23, Lakers,1610612747, Celtics,1610612738
01/21/2018 Magic at Celtics,21700683,2017-18,2018-01-21, Celtics,1610612738, Magic,1610612753
01/18/2018 76ers at Celtics,21700663,2017-18,2018-01-18, Celtics,1610612738, 76ers,1610612755
01/16/2018 Pelicans at Celtics,21700650,2017-18,2018-01-16, Celtics,1610612738, Pelicans,1610612740
01/11/2018 Celtics at 76ers,21700614,2017-18,2018-01-11, 76ers,1610612755, Celtics,1610612738
01/06/2018 Celtics at Nets,21700579,2017-18,2018-01-06, Nets,1610612751, Celtics,1610612738
01/05/2018 Timberwolves at Celtics,21700570,2017-18,2018-01-05, Celtics,1610612738, Timberwolves,1610612750
01/03/2018 Cavaliers at Celtics,21700559,2017-18,2018-01-03, Celtics,1610612738, Cavaliers,1610612739
12/31/2017 Nets at Celtics,21700539,2017-18,2017-12-31, Celtics,1610612738, Nets,1610612751
12/28/2017 Rockets at Celtics,21700517,2017-18,2017-12-28, Celtics,1610612738, Rockets,1610612745
12/27/2017 Celtics at Hornets,21700506,2017-18,2017-12-27, Hornets,1610612766, Celtics,1610612738
12/25/2017 Wizards at Celtics,21700495,2017-18,2017-12-25, Celtics,1610612738, Wizards,1610612764
12/23/2017 Bulls at Celtics,21700485,2017-18,2017-12-23, Celtics,1610612738, Bulls,1610612741
12/21/2017 Celtics at Knicks,21700468,2017-18,2017-12-21, Knicks,1610612752, Celtics,1610612738
12/20/2017 Heat at Celtics,21700456,2017-18,2017-12-20, Celtics,1610612738, Heat,1610612748
12/18/2017 Celtics at Pacers,21700442,2017-18,2017-12-18, Pacers,1610612754, Celtics,1610612738
12/16/2017 Celtics at Grizzlies,21700436,2017-18,2017-12-16, Grizzlies,1610612763, Celtics,1610612738
12/15/2017 Jazz at Celtics,21700423,2017-18,2017-12-15, Celtics,1610612738, Jazz,1610612762
12/13/2017 Nuggets at Celtics,21700407,2017-18,2017-12-13, Celtics,1610612738, Nuggets,1610612743
12/11/2017 Celtics at Bulls,21700391,2017-18,2017-12-11, Bulls,1610612741, Celtics,1610612738
12/10/2017 Celtics at Pistons,21700386,2017-18,2017-12-10, Pistons,1610612765, Celtics,1610612738
12/08/2017 Celtics at Spurs,21700374,2017-18,2017-12-08, Spurs,1610612759, Celtics,1610612738
12/06/2017 Mavericks at Celtics,21700356,2017-18,2017-12-06, Celtics,1610612738, Mavericks,1610612742
12/04/2017 Bucks at Celtics,21700343,2017-18,2017-12-04, Celtics,1610612738, Bucks,1610612749
12/02/2017 Suns at Celtics,21700326,2017-18,2017-12-02, Celtics,1610612738, Suns,1610612756
11/30/2017 76ers at Celtics,21700314,2017-18,2017-11-30, Celtics,1610612738, 76ers,1610612755
11/27/2017 Pistons at Celtics,21700292,2017-18,2017-11-27, Celtics,1610612738, Pistons,1610612765
11/25/2017 Celtics at Pacers,21700281,2017-18,2017-11-25, Pacers,1610612754, Celtics,1610612738
11/24/2017 Magic at Celtics,21700269,2017-18,2017-11-24, Celtics,1610612738, Magic,1610612753
11/22/2017 Celtics at Heat,21700257,2017-18,2017-11-22, Heat,1610612748, Celtics,1610612738
11/20/2017 Celtics at Mavericks,21700249,2017-18,2017-11-20, Mavericks,1610612742, Celtics,1610612738
11/16/2017 Warriors at Celtics,21700215,2017-18,2017-11-16, Celtics,1610612738, Warriors,1610612744
11/14/2017 Celtics at Nets,21700201,2017-18,2017-11-14, Nets,1610612751, Celtics,1610612738
11/12/2017 Raptors at Celtics,21700188,2017-18,2017-11-12, Celtics,1610612738, Raptors,1610612761
11/10/2017 Hornets at Celtics,21700170,2017-18,2017-11-10, Celtics,1610612738, Hornets,1610612766
11/08/2017 Lakers at Celtics,21700161,2017-18,2017-11-08, Celtics,1610612738, Lakers,1610612747
11/05/2017 Celtics at Magic,21700138,2017-18,2017-11-05, Magic,1610612753, Celtics,1610612738
11/03/2017 Celtics at Thunder,21700129,2017-18,2017-11-03, Thunder,1610612760, Celtics,1610612738
11/01/2017 Kings at Celtics,21700109,2017-18,2017-11-01, Celtics,1610612738, Kings,1610612758
10/30/2017 Spurs at Celtics,21700092,2017-18,2017-10-30, Celtics,1610612738, Spurs,1610612759
10/28/2017 Celtics at Heat,21700078,2017-18,2017-10-28, Heat,1610612748, Celtics,1610612738
10/26/2017 Celtics at Bucks,21700067,2017-18,2017-10-26, Bucks,1610612749, Celtics,1610612738
10/24/2017 Knicks at Celtics,21700051,2017-18,2017-10-24, Celtics,1610612738, Knicks,1610612752
10/20/2017 Celtics at 76ers,21700019,2017-18,2017-10-20, 76ers,1610612755, Celtics,1610612738
10/18/2017 Bucks at Celtics,21700007,2017-18,2017-10-18, Celtics,1610612738, Bucks,1610612749
10/17/2017 Celtics at Cavaliers,21700001,2017-18,2017-10-17, Cavaliers,1610612739, Celtics,1610612738
04/11/2018 Knicks at Cavaliers,21701220,2017-18,2018-04-11, Cavaliers,1610612739, Knicks,1610612752
04/09/2018 Cavaliers at Knicks,21701207,2017-18,2018-04-09, Knicks,1610612752, Cavaliers,1610612739
04/06/2018 Cavaliers at 76ers,21701183,2017-18,2018-04-06, 76ers,1610612755, Cavaliers,1610612739
04/05/2018 Wizards at Cavaliers,21701176,2017-18,2018-04-05, Cavaliers,1610612739, Wizards,1610612764
04/03/2018 Raptors at Cavaliers,21701156,2017-18,2018-04-03, Cavaliers,1610612739, Raptors,1610612761
04/01/2018 Mavericks at Cavaliers,21701149,2017-18,2018-04-01, Cavaliers,1610612739, Mavericks,1610612742
03/30/2018 Pelicans at Cavaliers,21701131,2017-18,2018-03-30, Cavaliers,1610612739, Pelicans,1610612740
03/28/2018 Cavaliers at Hornets,21701116,2017-18,2018-03-28, Hornets,1610612766, Cavaliers,1610612739
03/27/2018 Cavaliers at Heat,21701110,2017-18,2018-03-27, Heat,1610612748, Cavaliers,1610612739
03/25/2018 Cavaliers at Nets,21701094,2017-18,2018-03-25, Nets,1610612751, Cavaliers,1610612739
03/23/2018 Suns at Cavaliers,21701080,2017-18,2018-03-23, Cavaliers,1610612739, Suns,1610612756
03/21/2018 Raptors at Cavaliers,21701065,2017-18,2018-03-21, Cavaliers,1610612739, Raptors,1610612761
03/19/2018 Bucks at Cavaliers,21701050,2017-18,2018-03-19, Cavaliers,1610612739, Bucks,1610612749
03/17/2018 Cavaliers at Bulls,21701039,2017-18,2018-03-17, Bulls,1610612741, Cavaliers,1610612739
03/15/2018 Cavaliers at Trail Blazers,21701028,2017-18,2018-03-15, Trail Blazers,1610612757, Cavaliers,1610612739
03/13/2018 Cavaliers at Suns,21701014,2017-18,2018-03-13, Suns,1610612756, Cavaliers,1610612739
03/11/2018 Cavaliers at Lakers,21701000,2017-18,2018-03-11, Lakers,1610612747, Cavaliers,1610612739
03/09/2018 Cavaliers at Clippers,21700986,2017-18,2018-03-09, Clippers,1610612746, Cavaliers,1610612739
03/07/2018 Cavaliers at Nuggets,21700970,2017-18,2018-03-07, Nuggets,1610612743, Cavaliers,1610612739
03/05/2018 Pistons at Cavaliers,21700950,2017-18,2018-03-05, Cavaliers,1610612739, Pistons,1610612765
03/03/2018 Nuggets at Cavaliers,21700937,2017-18,2018-03-03, Cavaliers,1610612739, Nuggets,1610612743
03/01/2018 76ers at Cavaliers,21700923,2017-18,2018-03-01, Cavaliers,1610612739, 76ers,1610612755
02/27/2018 Nets at Cavaliers,21700908,2017-18,2018-02-27, Cavaliers,1610612739, Nets,1610612751
02/25/2018 Spurs at Cavaliers,21700894,2017-18,2018-02-25, Cavaliers,1610612739, Spurs,1610612759
02/23/2018 Cavaliers at Grizzlies,21700878,2017-18,2018-02-23, Grizzlies,1610612763, Cavaliers,1610612739
02/22/2018 Wizards at Cavaliers,21700869,2017-18,2018-02-22, Cavaliers,1610612739, Wizards,1610612764
02/13/2018 Cavaliers at Thunder,21700850,2017-18,2018-02-13, Thunder,1610612760, Cavaliers,1610612739
02/07/2018 Timberwolves at Cavaliers,21700807,2017-18,2018-02-07, Cavaliers,1610612739, Timberwolves,1610612750
02/06/2018 Cavaliers at Magic,21700797,2017-18,2018-02-06, Magic,1610612753, Cavaliers,1610612739
02/03/2018 Rockets at Cavaliers,21700779,2017-18,2018-02-03, Cavaliers,1610612739, Rockets,1610612745
01/31/2018 Heat at Cavaliers,21700757,2017-18,2018-01-31, Cavaliers,1610612739, Heat,1610612748
01/30/2018 Cavaliers at Pistons,21700747,2017-18,2018-01-30, Pistons,1610612765, Cavaliers,1610612739
01/28/2018 Pistons at Cavaliers,21700734,2017-18,2018-01-28, Cavaliers,1610612739, Pistons,1610612765
01/26/2018 Pacers at Cavaliers,21700715,2017-18,2018-01-26, Cavaliers,1610612739, Pacers,1610612754
01/23/2018 Cavaliers at Spurs,21700698,2017-18,2018-01-23, Spurs,1610612759, Cavaliers,1610612739
01/20/2018 Thunder at Cavaliers,21700674,2017-18,2018-01-20, Cavaliers,1610612739, Thunder,1610612760
01/18/2018 Magic at Cavaliers,21700664,2017-18,2018-01-18, Cavaliers,1610612739, Magic,1610612753
01/15/2018 Warriors at Cavaliers,21700646,2017-18,2018-01-15, Cavaliers,1610612739, Warriors,1610612744
01/12/2018 Cavaliers at Pacers,21700619,2017-18,2018-01-12, Pacers,1610612754, Cavaliers,1610612739
01/11/2018 Cavaliers at Raptors,21700615,2017-18,2018-01-11, Raptors,1610612761, Cavaliers,1610612739
01/08/2018 Cavaliers at Timberwolves,21700594,2017-18,2018-01-08, Timberwolves,1610612750, Cavaliers,1610612739
01/06/2018 Cavaliers at Magic,21700582,2017-18,2018-01-06, Magic,1610612753, Cavaliers,1610612739
01/02/2018 Trail Blazers at Cavaliers,21700549,2017-18,2018-01-02, Cavaliers,1610612739, Trail Blazers,1610612757
12/30/2017 Cavaliers at Jazz,21700534,2017-18,2017-12-30, Jazz,1610612762, Cavaliers,1610612739
12/27/2017 Cavaliers at Kings,21700513,2017-18,2017-12-27, Kings,1610612758, Cavaliers,1610612739
12/25/2017 Cavaliers at Warriors,21700494,2017-18,2017-12-25, Warriors,1610612744, Cavaliers,1610612739
12/21/2017 Bulls at Cavaliers,21700466,2017-18,2017-12-21, Cavaliers,1610612739, Bulls,1610612741
12/19/2017 Cavaliers at Bucks,21700453,2017-18,2017-12-19, Bucks,1610612749, Cavaliers,1610612739
12/17/2017 Cavaliers at Wizards,21700440,2017-18,2017-12-17, Wizards,1610612764, Cavaliers,1610612739
12/16/2017 Jazz at Cavaliers,21700430,2017-18,2017-12-16, Cavaliers,1610612739, Jazz,1610612762
12/14/2017 Lakers at Cavaliers,21700415,2017-18,2017-12-14, Cavaliers,1610612739, Lakers,1610612747
12/09/2017 76ers at Cavaliers,21700379,2017-18,2017-12-09, Cavaliers,1610612739, 76ers,1610612755
12/08/2017 Cavaliers at Pacers,21700369,2017-18,2017-12-08, Pacers,1610612754, Cavaliers,1610612739
12/06/2017 Kings at Cavaliers,21700353,2017-18,2017-12-06, Cavaliers,1610612739, Kings,1610612758
12/04/2017 Cavaliers at Bulls,21700344,2017-18,2017-12-04, Bulls,1610612741, Cavaliers,1610612739
12/02/2017 Grizzlies at Cavaliers,21700329,2017-18,2017-12-02, Cavaliers,1610612739, Grizzlies,1610612763
11/28/2017 Heat at Cavaliers,21700298,2017-18,2017-11-28, Cavaliers,1610612739, Heat,1610612748
11/27/2017 Cavaliers at 76ers,21700291,2017-18,2017-11-27, 76ers,1610612755, Cavaliers,1610612739
11/24/2017 Hornets at Cavaliers,21700270,2017-18,2017-11-24, Cavaliers,1610612739, Hornets,1610612766
11/22/2017 Nets at Cavaliers,21700254,2017-18,2017-11-22, Cavaliers,1610612739, Nets,1610612751
11/20/2017 Cavaliers at Pistons,21700242,2017-18,2017-11-20, Pistons,1610612765, Cavaliers,1610612739
11/17/2017 Clippers at Cavaliers,21700220,2017-18,2017-11-17, Cavaliers,1610612739, Clippers,1610612746
11/15/2017 Cavaliers at Hornets,21700207,2017-18,2017-11-15, Hornets,1610612766, Cavaliers,1610612739
11/13/2017 Cavaliers at Knicks,21700193,2017-18,2017-11-13, Knicks,1610612752, Cavaliers,1610612739
11/11/2017 Cavaliers at Mavericks,21700181,2017-18,2017-11-11, Mavericks,1610612742, Cavaliers,1610612739
11/09/2017 Cavaliers at Rockets,21700166,2017-18,2017-11-09, Rockets,1610612745, Cavaliers,1610612739
11/07/2017 Bucks at Cavaliers,21700149,2017-18,2017-11-07, Cavaliers,1610612739, Bucks,1610612749
11/03/2017 Cavaliers at Wizards,21700122,2017-18,2017-11-03, Wizards,1610612764, Cavaliers,1610612739
11/01/2017 Pacers at Cavaliers,21700106,2017-18,2017-11-01, Cavaliers,1610612739, Pacers,1610612754
10/29/2017 Knicks at Cavaliers,21700090,2017-18,2017-10-29, Cavaliers,1610612739, Knicks,1610612752
10/28/2017 Cavaliers at Pelicans,21700077,2017-18,2017-10-28, Pelicans,1610612740, Cavaliers,1610612739
10/25/2017 Cavaliers at Nets,21700058,2017-18,2017-10-25, Nets,1610612751, Cavaliers,1610612739
10/24/2017 Bulls at Cavaliers,21700049,2017-18,2017-10-24, Cavaliers,1610612739, Bulls,1610612741
10/21/2017 Magic at Cavaliers,21700028,2017-18,2017-10-21, Cavaliers,1610612739, Magic,1610612753
10/20/2017 Cavaliers at Bucks,21700021,2017-18,2017-10-20, Bucks,1610612749, Cavaliers,1610612739
04/11/2018 Spurs at Pelicans,21701226,2017-18,2018-04-11, Pelicans,1610612740, Spurs,1610612759
04/09/2018 Pelicans at Clippers,21701212,2017-18,2018-04-09, Clippers,1610612746, Pelicans,1610612740
04/07/2018 Pelicans at Warriors,21701195,2017-18,2018-04-07, Warriors,1610612744, Pelicans,1610612740
04/06/2018 Pelicans at Suns,21701189,2017-18,2018-04-06, Suns,1610612756, Pelicans,1610612740
04/04/2018 Grizzlies at Pelicans,21701173,2017-18,2018-04-04, Pelicans,1610612740, Grizzlies,1610612763
04/01/2018 Thunder at Pelicans,21701150,2017-18,2018-04-01, Pelicans,1610612740, Thunder,1610612760
03/27/2018 Trail Blazers at Pelicans,21701112,2017-18,2018-03-27, Pelicans,1610612740, Trail Blazers,1610612757
03/24/2018 Pelicans at Rockets,21701091,2017-18,2018-03-24, Rockets,1610612745, Pelicans,1610612740
03/22/2018 Lakers at Pelicans,21701075,2017-18,2018-03-22, Pelicans,1610612740, Lakers,1610612747
03/21/2018 Pacers at Pelicans,21700809,2017-18,2018-03-21, Pelicans,1610612740, Pacers,1610612754
03/20/2018 Mavericks at Pelicans,21701061,2017-18,2018-03-20, Pelicans,1610612740, Mavericks,1610612742
03/17/2018 Rockets at Pelicans,21701036,2017-18,2018-03-17, Pelicans,1610612740, Rockets,1610612745
03/15/2018 Pelicans at Spurs,21701025,2017-18,2018-03-15, Spurs,1610612759, Pelicans,1610612740
03/13/2018 Hornets at Pelicans,21701011,2017-18,2018-03-13, Pelicans,1610612740, Hornets,1610612766
03/11/2018 Jazz at Pelicans,21700995,2017-18,2018-03-11, Pelicans,1610612740, Jazz,1610612762
03/09/2018 Wizards at Pelicans,21700982,2017-18,2018-03-09, Pelicans,1610612740, Wizards,1610612764
03/07/2018 Pelicans at Kings,21700969,2017-18,2018-03-07, Kings,1610612758, Pelicans,1610612740
03/06/2018 Pelicans at Clippers,21700964,2017-18,2018-03-06, Clippers,1610612746, Pelicans,1610612740
03/04/2018 Pelicans at Mavericks,21700946,2017-18,2018-03-04, Mavericks,1610612742, Pelicans,1610612740
02/28/2018 Pelicans at Spurs,21700920,2017-18,2018-02-28, Spurs,1610612759, Pelicans,1610612740
02/26/2018 Suns at Pelicans,21700902,2017-18,2018-02-26, Pelicans,1610612740, Suns,1610612756
02/25/2018 Pelicans at Bucks,21700893,2017-18,2018-02-25, Bucks,1610612749, Pelicans,1610612740
02/23/2018 Heat at Pelicans,21700879,2017-18,2018-02-23, Pelicans,1610612740, Heat,1610612748
02/14/2018 Lakers at Pelicans,21700862,2017-18,2018-02-14, Pelicans,1610612740, Lakers,1610612747
02/12/2018 Pelicans at Pistons,21700841,2017-18,2018-02-12, Pistons,1610612765, Pelicans,1610612740
02/10/2018 Pelicans at Nets,21700826,2017-18,2018-02-10, Nets,1610612751, Pelicans,1610612740
02/09/2018 Pelicans at 76ers,21700818,2017-18,2018-02-09, 76ers,1610612755, Pelicans,1610612740
02/05/2018 Jazz at Pelicans,21700793,2017-18,2018-02-05, Pelicans,1610612740, Jazz,1610612762
02/03/2018 Pelicans at Timberwolves,21700780,2017-18,2018-02-03, Timberwolves,1610612750, Pelicans,1610612740
02/02/2018 Pelicans at Thunder,21700772,2017-18,2018-02-02, Thunder,1610612760, Pelicans,1610612740
01/30/2018 Kings at Pelicans,21700749,2017-18,2018-01-30, Pelicans,1610612740, Kings,1610612758
01/28/2018 Clippers at Pelicans,21700733,2017-18,2018-01-28, Pelicans,1610612740, Clippers,1610612746
01/26/2018 Rockets at Pelicans,21700720,2017-18,2018-01-26, Pelicans,1610612740, Rockets,1610612745
01/24/2018 Pelicans at Hornets,21700701,2017-18,2018-01-24, Hornets,1610612766, Pelicans,1610612740
01/22/2018 Bulls at Pelicans,21700692,2017-18,2018-01-22, Pelicans,1610612740, Bulls,1610612741
01/20/2018 Grizzlies at Pelicans,21700677,2017-18,2018-01-20, Pelicans,1610612740, Grizzlies,1610612763
01/14/2018 Pelicans at Knicks,21700635,2017-18,2018-01-14, Knicks,1610612752, Pelicans,1610612740
01/12/2018 Trail Blazers at Pelicans,21700624,2017-18,2018-01-12, Pelicans,1610612740, Trail Blazers,1610612757
01/10/2018 Pelicans at Grizzlies,21700609,2017-18,2018-01-10, Grizzlies,1610612763, Pelicans,1610612740
01/08/2018 Pistons at Pelicans,21700595,2017-18,2018-01-08, Pelicans,1610612740, Pistons,1610612765
01/06/2018 Pelicans at Timberwolves,21700584,2017-18,2018-01-06, Timberwolves,1610612750, Pelicans,1610612740
01/03/2018 Pelicans at Jazz,21700564,2017-18,2018-01-03, Jazz,1610612762, Pelicans,1610612740
12/30/2017 Knicks at Pelicans,21700532,2017-18,2017-12-30, Pelicans,1610612740, Knicks,1610612752
12/29/2017 Mavericks at Pelicans,21700525,2017-18,2017-12-29, Pelicans,1610612740, Mavericks,1610612742
12/27/2017 Nets at Pelicans,21700511,2017-18,2017-12-27, Pelicans,1610612740, Nets,1610612751
12/23/2017 Pelicans at Heat,21700486,2017-18,2017-12-23, Heat,1610612748, Pelicans,1610612740
12/22/2017 Pelicans at Magic,21700472,2017-18,2017-12-22, Magic,1610612753, Pelicans,1610612740
12/19/2017 Pelicans at Wizards,21700452,2017-18,2017-12-19, Wizards,1610612764, Pelicans,1610612740
12/15/2017 Pelicans at Nuggets,21700427,2017-18,2017-12-15, Nuggets,1610612743, Pelicans,1610612740
12/13/2017 Bucks at Pelicans,21700410,2017-18,2017-12-13, Pelicans,1610612740, Bucks,1610612749
12/11/2017 Pelicans at Rockets,21700392,2017-18,2017-12-11, Rockets,1610612745, Pelicans,1610612740
12/10/2017 76ers at Pelicans,21700389,2017-18,2017-12-10, Pelicans,1610612740, 76ers,1610612755
12/08/2017 Kings at Pelicans,21700373,2017-18,2017-12-08, Pelicans,1610612740, Kings,1610612758
12/06/2017 Nuggets at Pelicans,21700360,2017-18,2017-12-06, Pelicans,1610612740, Nuggets,1610612743
12/04/2017 Warriors at Pelicans,21700346,2017-18,2017-12-04, Pelicans,1610612740, Warriors,1610612744
12/02/2017 Pelicans at Trail Blazers,21700333,2017-18,2017-12-02, Trail Blazers,1610612757, Pelicans,1610612740
12/01/2017 Pelicans at Jazz,21700325,2017-18,2017-12-01, Jazz,1610612762, Pelicans,1610612740
11/29/2017 Timberwolves at Pelicans,21700309,2017-18,2017-11-29, Pelicans,1610612740, Timberwolves,1610612750
11/25/2017 Pelicans at Warriors,21700284,2017-18,2017-11-25, Warriors,1610612744, Pelicans,1610612740
11/24/2017 Pelicans at Suns,21700275,2017-18,2017-11-24, Suns,1610612756, Pelicans,1610612740
11/22/2017 Spurs at Pelicans,21700262,2017-18,2017-11-22, Pelicans,1610612740, Spurs,1610612759
11/20/2017 Thunder at Pelicans,21700248,2017-18,2017-11-20, Pelicans,1610612740, Thunder,1610612760
11/17/2017 Pelicans at Nuggets,21700226,2017-18,2017-11-17, Nuggets,1610612743, Pelicans,1610612740
11/15/2017 Raptors at Pelicans,21700211,2017-18,2017-11-15, Pelicans,1610612740, Raptors,1610612761
11/11/2017 Clippers at Pelicans,21700178,2017-18,2017-11-11, Pelicans,1610612740, Clippers,1610612746
11/09/2017 Pelicans at Raptors,21700165,2017-18,2017-11-09, Raptors,1610612761, Pelicans,1610612740
11/07/2017 Pelicans at Pacers,21700150,2017-18,2017-11-07, Pacers,1610612754, Pelicans,1610612740
11/04/2017 Pelicans at Bulls,21700133,2017-18,2017-11-04, Bulls,1610612741, Pelicans,1610612740
11/03/2017 Pelicans at Mavericks,21700125,2017-18,2017-11-03, Mavericks,1610612742, Pelicans,1610612740
11/01/2017 Timberwolves at Pelicans,21700113,2017-18,2017-11-01, Pelicans,1610612740, Timberwolves,1610612750
10/30/2017 Magic at Pelicans,21700097,2017-18,2017-10-30, Pelicans,1610612740, Magic,1610612753
10/26/2017 Pelicans at Kings,21700069,2017-18,2017-10-26, Kings,1610612758, Pelicans,1610612740
10/24/2017 Pelicans at Trail Blazers,21700053,2017-18,2017-10-24, Trail Blazers,1610612757, Pelicans,1610612740
10/22/2017 Pelicans at Lakers,21700040,2017-18,2017-10-22, Lakers,1610612747, Pelicans,1610612740
10/20/2017 Warriors at Pelicans,21700025,2017-18,2017-10-20, Pelicans,1610612740, Warriors,1610612744
10/18/2017 Pelicans at Grizzlies,21700008,2017-18,2017-10-18, Grizzlies,1610612763, Pelicans,1610612740
04/11/2018 Pistons at Bulls,21701224,2017-18,2018-04-11, Bulls,1610612741, Pistons,1610612765
04/09/2018 Bulls at Nets,21701205,2017-18,2018-04-09, Nets,1610612751, Bulls,1610612741
04/07/2018 Nets at Bulls,21701193,2017-18,2018-04-07, Bulls,1610612741, Nets,1610612751
04/03/2018 Hornets at Bulls,21701160,2017-18,2018-04-03, Bulls,1610612741, Hornets,1610612766
04/01/2018 Wizards at Bulls,21701144,2017-18,2018-04-01, Bulls,1610612741, Wizards,1610612764
03/30/2018 Bulls at Magic,21701129,2017-18,2018-03-30, Magic,1610612753, Bulls,1610612741
03/29/2018 Bulls at Heat,21701125,2017-18,2018-03-29, Heat,1610612748, Bulls,1610612741
03/27/2018 Bulls at Rockets,21701111,2017-18,2018-03-27, Rockets,1610612745, Bulls,1610612741
03/24/2018 Bulls at Pistons,21701089,2017-18,2018-03-24, Pistons,1610612765, Bulls,1610612741
03/23/2018 Bucks at Bulls,21701083,2017-18,2018-03-23, Bulls,1610612741, Bucks,1610612749
03/21/2018 Nuggets at Bulls,21701069,2017-18,2018-03-21, Bulls,1610612741, Nuggets,1610612743
03/19/2018 Bulls at Knicks,21701055,2017-18,2018-03-19, Knicks,1610612752, Bulls,1610612741
03/15/2018 Bulls at Grizzlies,21701024,2017-18,2018-03-15, Grizzlies,1610612763, Bulls,1610612741
03/13/2018 Clippers at Bulls,21701010,2017-18,2018-03-13, Bulls,1610612741, Clippers,1610612746
03/09/2018 Bulls at Pistons,21700977,2017-18,2018-03-09, Pistons,1610612765, Bulls,1610612741
03/07/2018 Grizzlies at Bulls,21700967,2017-18,2018-03-07, Bulls,1610612741, Grizzlies,1610612763
03/02/2018 Mavericks at Bulls,21700930,2017-18,2018-03-02, Bulls,1610612741, Mavericks,1610612742
02/27/2018 Bulls at Hornets,21700907,2017-18,2018-02-27, Hornets,1610612766, Bulls,1610612741
02/26/2018 Bulls at Nets,21700899,2017-18,2018-02-26, Nets,1610612751, Bulls,1610612741
02/24/2018 Bulls at Timberwolves,21700888,2017-18,2018-02-24, Timberwolves,1610612750, Bulls,1610612741
02/22/2018 76ers at Bulls,21700870,2017-18,2018-02-22, Bulls,1610612741, 76ers,1610612755
02/14/2018 Raptors at Bulls,21700859,2017-18,2018-02-14, Bulls,1610612741, Raptors,1610612761
02/12/2018 Magic at Bulls,21700844,2017-18,2018-02-12, Bulls,1610612741, Magic,1610612753
02/10/2018 Wizards at Bulls,21700829,2017-18,2018-02-10, Bulls,1610612741, Wizards,1610612764
02/09/2018 Timberwolves at Bulls,21700822,2017-18,2018-02-09, Bulls,1610612741, Timberwolves,1610612750
02/05/2018 Bulls at Kings,21700795,2017-18,2018-02-05, Kings,1610612758, Bulls,1610612741
02/03/2018 Bulls at Clippers,21700775,2017-18,2018-02-03, Clippers,1610612746, Bulls,1610612741
01/31/2018 Bulls at Trail Blazers,21700759,2017-18,2018-01-31, Trail Blazers,1610612757, Bulls,1610612741
01/28/2018 Bucks at Bulls,21700731,2017-18,2018-01-28, Bulls,1610612741, Bucks,1610612749
01/26/2018 Lakers at Bulls,21700717,2017-18,2018-01-26, Bulls,1610612741, Lakers,1610612747
01/24/2018 Bulls at 76ers,21700704,2017-18,2018-01-24, 76ers,1610612755, Bulls,1610612741
01/17/2018 Warriors at Bulls,21700657,2017-18,2018-01-17, Bulls,1610612741, Warriors,1610612744
01/15/2018 Heat at Bulls,21700644,2017-18,2018-01-15, Bulls,1610612741, Heat,1610612748
01/13/2018 Pistons at Bulls,21700632,2017-18,2018-01-13, Bulls,1610612741, Pistons,1610612765
01/10/2018 Bulls at Knicks,21700607,2017-18,2018-01-10, Knicks,1610612752, Bulls,1610612741
01/08/2018 Rockets at Bulls,21700593,2017-18,2018-01-08, Bulls,1610612741, Rockets,1610612745
01/06/2018 Bulls at Pacers,21700581,2017-18,2018-01-06, Pacers,1610612754, Bulls,1610612741
01/05/2018 Bulls at Mavericks,21700572,2017-18,2018-01-05, Mavericks,1610612742, Bulls,1610612741
01/03/2018 Raptors at Bulls,21700560,2017-18,2018-01-03, Bulls,1610612741, Raptors,1610612761
01/01/2018 Trail Blazers at Bulls,21700547,2017-18,2018-01-01, Bulls,1610612741, Trail Blazers,1610612757
12/31/2017 Bulls at Wizards,21700537,2017-18,2017-12-31, Wizards,1610612764, Bulls,1610612741
12/29/2017 Pacers at Bulls,21700524,2017-18,2017-12-29, Bulls,1610612741, Pacers,1610612754
12/27/2017 Knicks at Bulls,21700509,2017-18,2017-12-27, Bulls,1610612741, Knicks,1610612752
12/26/2017 Bulls at Bucks,21700501,2017-18,2017-12-26, Bucks,1610612749, Bulls,1610612741
12/20/2017 Magic at Bulls,21700458,2017-18,2017-12-20, Bulls,1610612741, Magic,1610612753
12/18/2017 76ers at Bulls,21700444,2017-18,2017-12-18, Bulls,1610612741, 76ers,1610612755
12/15/2017 Bulls at Bucks,21700426,2017-18,2017-12-15, Bucks,1610612749, Bulls,1610612741
12/13/2017 Jazz at Bulls,21700409,2017-18,2017-12-13, Bulls,1610612741, Jazz,1610612762
12/09/2017 Knicks at Bulls,21700380,2017-18,2017-12-09, Bulls,1610612741, Knicks,1610612752
12/08/2017 Bulls at Hornets,21700367,2017-18,2017-12-08, Hornets,1610612766, Bulls,1610612741
12/06/2017 Bulls at Pacers,21700354,2017-18,2017-12-06, Pacers,1610612754, Bulls,1610612741
12/01/2017 Kings at Bulls,21700322,2017-18,2017-12-01, Bulls,1610612741, Kings,1610612758
11/30/2017 Bulls at Nuggets,21700315,2017-18,2017-11-30, Nuggets,1610612743, Bulls,1610612741
11/28/2017 Suns at Bulls,21700299,2017-18,2017-11-28, Bulls,1610612741, Suns,1610612756
11/26/2017 Heat at Bulls,21700287,2017-18,2017-11-26, Bulls,1610612741, Heat,1610612748
11/24/2017 Bulls at Warriors,21700276,2017-18,2017-11-24, Warriors,1610612744, Bulls,1610612741
11/22/2017 Bulls at Jazz,21700265,2017-18,2017-11-22, Jazz,1610612762, Bulls,1610612741
11/21/2017 Bulls at Lakers,21700252,2017-18,2017-11-21, Lakers,1610612747, Bulls,1610612741
11/19/2017 Bulls at Suns,21700239,2017-18,2017-11-19, Suns,1610612756, Bulls,1610612741
11/17/2017 Hornets at Bulls,21700222,2017-18,2017-11-17, Bulls,1610612741, Hornets,1610612766
11/15/2017 Bulls at Thunder,21700212,2017-18,2017-11-15, Thunder,1610612760, Bulls,1610612741
11/11/2017 Bulls at Spurs,21700183,2017-18,2017-11-11, Spurs,1610612759, Bulls,1610612741
11/10/2017 Pacers at Bulls,21700171,2017-18,2017-11-10, Bulls,1610612741, Pacers,1610612754
11/07/2017 Bulls at Raptors,21700153,2017-18,2017-11-07, Raptors,1610612761, Bulls,1610612741
11/03/2017 Bulls at Magic,21700120,2017-18,2017-11-03, Magic,1610612753, Bulls,1610612741
11/01/2017 Bulls at Heat,21700110,2017-18,2017-11-01, Heat,1610612748, Bulls,1610612741
10/28/2017 Thunder at Bulls,21700079,2017-18,2017-10-28, Bulls,1610612741, Thunder,1610612760
10/21/2017 Spurs at Bulls,21700031,2017-18,2017-10-21, Bulls,1610612741, Spurs,1610612759
10/19/2017 Bulls at Raptors,21700014,2017-18,2017-10-19, Raptors,1610612761, Bulls,1610612741
04/10/2018 Suns at Mavericks,21701216,2017-18,2018-04-10, Mavericks,1610612742, Suns,1610612756
04/08/2018 Mavericks at 76ers,21701198,2017-18,2018-04-08, 76ers,1610612755, Mavericks,1610612742
04/06/2018 Mavericks at Pistons,21701181,2017-18,2018-04-06, Pistons,1610612765, Mavericks,1610612742
04/04/2018 Mavericks at Magic,21701170,2017-18,2018-04-04, Magic,1610612753, Mavericks,1610612742
04/03/2018 Trail Blazers at Mavericks,21701164,2017-18,2018-04-03, Mavericks,1610612742, Trail Blazers,1610612757
03/30/2018 Timberwolves at Mavericks,21701134,2017-18,2018-03-30, Mavericks,1610612742, Timberwolves,1610612750
03/28/2018 Mavericks at Lakers,21701123,2017-18,2018-03-28, Lakers,1610612747, Mavericks,1610612742
03/27/2018 Mavericks at Kings,21701113,2017-18,2018-03-27, Kings,1610612758, Mavericks,1610612742
03/24/2018 Hornets at Mavericks,21701093,2017-18,2018-03-24, Mavericks,1610612742, Hornets,1610612766
03/22/2018 Jazz at Mavericks,21701076,2017-18,2018-03-22, Mavericks,1610612742, Jazz,1610612762
03/17/2018 Mavericks at Nets,21701037,2017-18,2018-03-17, Nets,1610612751, Mavericks,1610612742
03/16/2018 Mavericks at Raptors,21701031,2017-18,2018-03-16, Raptors,1610612761, Mavericks,1610612742
03/13/2018 Mavericks at Knicks,21701009,2017-18,2018-03-13, Knicks,1610612752, Mavericks,1610612742
03/11/2018 Rockets at Mavericks,21700997,2017-18,2018-03-11, Mavericks,1610612742, Rockets,1610612745
03/10/2018 Grizzlies at Mavericks,21700989,2017-18,2018-03-10, Mavericks,1610612742, Grizzlies,1610612763
03/06/2018 Nuggets at Mavericks,21700961,2017-18,2018-03-06, Mavericks,1610612742, Nuggets,1610612743
02/28/2018 Thunder at Mavericks,21700919,2017-18,2018-02-28, Mavericks,1610612742, Thunder,1610612760
02/26/2018 Pacers at Mavericks,21700904,2017-18,2018-02-26, Mavericks,1610612742, Pacers,1610612754
02/24/2018 Mavericks at Jazz,21700890,2017-18,2018-02-24, Jazz,1610612762, Mavericks,1610612742
02/23/2018 Mavericks at Lakers,21700883,2017-18,2018-02-23, Lakers,1610612747, Mavericks,1610612742
02/13/2018 Kings at Mavericks,21700851,2017-18,2018-02-13, Mavericks,1610612742, Kings,1610612758
02/11/2018 Mavericks at Rockets,21700837,2017-18,2018-02-11, Rockets,1610612745, Mavericks,1610612742
02/10/2018 Lakers at Mavericks,21700830,2017-18,2018-02-10, Mavericks,1610612742, Lakers,1610612747
02/08/2018 Mavericks at Warriors,21700815,2017-18,2018-02-08, Warriors,1610612744, Mavericks,1610612742
02/05/2018 Mavericks at Clippers,21700796,2017-18,2018-02-05, Clippers,1610612746, Mavericks,1610612742
02/03/2018 Mavericks at Kings,21700783,2017-18,2018-02-03, Kings,1610612758, Mavericks,1610612742
01/31/2018 Mavericks at Suns,21700760,2017-18,2018-01-31, Suns,1610612756, Mavericks,1610612742
01/29/2018 Heat at Mavericks,21700742,2017-18,2018-01-29, Mavericks,1610612742, Heat,1610612748
01/27/2018 Mavericks at Nuggets,21700730,2017-18,2018-01-27, Nuggets,1610612743, Mavericks,1610612742
01/26/2018 Trail Blazers at Mavericks,21700721,2017-18,2018-01-26, Mavericks,1610612742, Trail Blazers,1610612757
01/24/2018 Rockets at Mavericks,21700706,2017-18,2018-01-24, Mavericks,1610612742, Rockets,1610612745
01/22/2018 Wizards at Mavericks,21700693,2017-18,2018-01-22, Mavericks,1610612742, Wizards,1610612764
01/20/2018 Mavericks at Trail Blazers,21700682,2017-18,2018-01-20, Trail Blazers,1610612757, Mavericks,1610612742
01/16/2018 Mavericks at Nuggets,21700651,2017-18,2018-01-16, Nuggets,1610612743, Mavericks,1610612742
01/13/2018 Lakers at Mavericks,21700627,2017-18,2018-01-13, Mavericks,1610612742, Lakers,1610612747
01/10/2018 Mavericks at Hornets,21700603,2017-18,2018-01-10, Hornets,1610612766, Mavericks,1610612742
01/09/2018 Magic at Mavericks,21700601,2017-18,2018-01-09, Mavericks,1610612742, Magic,1610612753
01/07/2018 Knicks at Mavericks,21700587,2017-18,2018-01-07, Mavericks,1610612742, Knicks,1610612752
01/03/2018 Warriors at Mavericks,21700562,2017-18,2018-01-03, Mavericks,1610612742, Warriors,1610612744
12/31/2017 Mavericks at Thunder,21700541,2017-18,2017-12-31, Thunder,1610612760, Mavericks,1610612742
12/27/2017 Mavericks at Pacers,21700507,2017-18,2017-12-27, Pacers,1610612754, Mavericks,1610612742
12/26/2017 Raptors at Mavericks,21700499,2017-18,2017-12-26, Mavericks,1610612742, Raptors,1610612761
12/22/2017 Mavericks at Heat,21700474,2017-18,2017-12-22, Heat,1610612748, Mavericks,1610612742
12/20/2017 Pistons at Mavericks,21700461,2017-18,2017-12-20, Mavericks,1610612742, Pistons,1610612765
12/18/2017 Suns at Mavericks,21700448,2017-18,2017-12-18, Mavericks,1610612742, Suns,1610612756
12/16/2017 Mavericks at Spurs,21700435,2017-18,2017-12-16, Spurs,1610612759, Mavericks,1610612742
12/14/2017 Mavericks at Warriors,21700417,2017-18,2017-12-14, Warriors,1610612744, Mavericks,1610612742
12/12/2017 Spurs at Mavericks,21700402,2017-18,2017-12-12, Mavericks,1610612742, Spurs,1610612759
12/10/2017 Mavericks at Timberwolves,21700388,2017-18,2017-12-10, Timberwolves,1610612750, Mavericks,1610612742
12/08/2017 Mavericks at Bucks,21700372,2017-18,2017-12-08, Bucks,1610612749, Mavericks,1610612742
12/04/2017 Nuggets at Mavericks,21700347,2017-18,2017-12-04, Mavericks,1610612742, Nuggets,1610612743
12/02/2017 Clippers at Mavericks,21700327,2017-18,2017-12-02, Mavericks,1610612742, Clippers,1610612746
11/29/2017 Nets at Mavericks,21700310,2017-18,2017-11-29, Mavericks,1610612742, Nets,1610612751
11/27/2017 Mavericks at Spurs,21700295,2017-18,2017-11-27, Spurs,1610612759, Mavericks,1610612742
11/25/2017 Thunder at Mavericks,21700283,2017-18,2017-11-25, Mavericks,1610612742, Thunder,1610612760
11/22/2017 Mavericks at Grizzlies,21700260,2017-18,2017-11-22, Grizzlies,1610612763, Mavericks,1610612742
11/18/2017 Bucks at Mavericks,21700233,2017-18,2017-11-18, Mavericks,1610612742, Bucks,1610612749
11/17/2017 Timberwolves at Mavericks,21700224,2017-18,2017-11-17, Mavericks,1610612742, Timberwolves,1610612750
11/14/2017 Spurs at Mavericks,21700203,2017-18,2017-11-14, Mavericks,1610612742, Spurs,1610612759
11/12/2017 Mavericks at Thunder,21700191,2017-18,2017-11-12, Thunder,1610612760, Mavericks,1610612742
11/07/2017 Mavericks at Wizards,21700151,2017-18,2017-11-07, Wizards,1610612764, Mavericks,1610612742
11/04/2017 Mavericks at Timberwolves,21700134,2017-18,2017-11-04, Timberwolves,1610612750, Mavericks,1610612742
11/01/2017 Mavericks at Clippers,21700116,2017-18,2017-11-01, Clippers,1610612746, Mavericks,1610612742
10/30/2017 Mavericks at Jazz,21700098,2017-18,2017-10-30, Jazz,1610612762, Mavericks,1610612742
10/28/2017 76ers at Mavericks,21700081,2017-18,2017-10-28, Mavericks,1610612742, 76ers,1610612755
10/26/2017 Mavericks at Grizzlies,21700066,2017-18,2017-10-26, Grizzlies,1610612763, Mavericks,1610612742
10/25/2017 Grizzlies at Mavericks,21700061,2017-18,2017-10-25, Mavericks,1610612742, Grizzlies,1610612763
10/23/2017 Warriors at Mavericks,21700045,2017-18,2017-10-23, Mavericks,1610612742, Warriors,1610612744
10/21/2017 Mavericks at Rockets,21700032,2017-18,2017-10-21, Rockets,1610612745, Mavericks,1610612742
10/20/2017 Kings at Mavericks,21700024,2017-18,2017-10-20, Mavericks,1610612742, Kings,1610612758
04/11/2018 Nuggets at Timberwolves,21701225,2017-18,2018-04-11, Timberwolves,1610612750, Nuggets,1610612743
04/09/2018 Trail Blazers at Nuggets,21701211,2017-18,2018-04-09, Nuggets,1610612743, Trail Blazers,1610612757
04/07/2018 Nuggets at Clippers,21701191,2017-18,2018-04-07, Clippers,1610612746, Nuggets,1610612743
04/05/2018 Timberwolves at Nuggets,21701180,2017-18,2018-04-05, Nuggets,1610612743, Timberwolves,1610612750
04/03/2018 Pacers at Nuggets,21701165,2017-18,2018-04-03, Nuggets,1610612743, Pacers,1610612754
04/01/2018 Bucks at Nuggets,21701152,2017-18,2018-04-01, Nuggets,1610612743, Bucks,1610612749
03/30/2018 Nuggets at Thunder,21701133,2017-18,2018-03-30, Thunder,1610612760, Nuggets,1610612743
03/27/2018 Nuggets at Raptors,21701109,2017-18,2018-03-27, Raptors,1610612761, Nuggets,1610612743
03/26/2018 Nuggets at 76ers,21701105,2017-18,2018-03-26, 76ers,1610612755, Nuggets,1610612743
03/23/2018 Nuggets at Wizards,21701079,2017-18,2018-03-23, Wizards,1610612764, Nuggets,1610612743
03/19/2018 Nuggets at Heat,21701054,2017-18,2018-03-19, Heat,1610612748, Nuggets,1610612743
03/17/2018 Nuggets at Grizzlies,21701040,2017-18,2018-03-17, Grizzlies,1610612763, Nuggets,1610612743
03/15/2018 Pistons at Nuggets,21701026,2017-18,2018-03-15, Nuggets,1610612743, Pistons,1610612765
03/13/2018 Nuggets at Lakers,21701015,2017-18,2018-03-13, Lakers,1610612747, Nuggets,1610612743
03/11/2018 Kings at Nuggets,21700996,2017-18,2018-03-11, Nuggets,1610612743, Kings,1610612758
03/09/2018 Lakers at Nuggets,21700983,2017-18,2018-03-09, Nuggets,1610612743, Lakers,1610612747
03/02/2018 Nuggets at Grizzlies,21700931,2017-18,2018-03-02, Grizzlies,1610612763, Nuggets,1610612743
02/27/2018 Clippers at Nuggets,21700912,2017-18,2018-02-27, Nuggets,1610612743, Clippers,1610612746
02/25/2018 Rockets at Nuggets,21700896,2017-18,2018-02-25, Nuggets,1610612743, Rockets,1610612745
02/23/2018 Spurs at Nuggets,21700880,2017-18,2018-02-23, Nuggets,1610612743, Spurs,1610612759
02/15/2018 Nuggets at Bucks,21700865,2017-18,2018-02-15, Bucks,1610612749, Nuggets,1610612743
02/13/2018 Spurs at Nuggets,21700852,2017-18,2018-02-13, Nuggets,1610612743, Spurs,1610612759
02/10/2018 Nuggets at Suns,21700832,2017-18,2018-02-10, Suns,1610612756, Nuggets,1610612743
02/09/2018 Nuggets at Rockets,21700823,2017-18,2018-02-09, Rockets,1610612745, Nuggets,1610612743
02/05/2018 Hornets at Nuggets,21700794,2017-18,2018-02-05, Nuggets,1610612743, Hornets,1610612766
02/03/2018 Warriors at Nuggets,21700782,2017-18,2018-02-03, Nuggets,1610612743, Warriors,1610612744
02/01/2018 Thunder at Nuggets,21700765,2017-18,2018-02-01, Nuggets,1610612743, Thunder,1610612760
01/30/2018 Nuggets at Spurs,21700750,2017-18,2018-01-30, Spurs,1610612759, Nuggets,1610612743
01/25/2018 Knicks at Nuggets,21700712,2017-18,2018-01-25, Nuggets,1610612743, Knicks,1610612752
01/22/2018 Trail Blazers at Nuggets,21700694,2017-18,2018-01-22, Nuggets,1610612743, Trail Blazers,1610612757
01/19/2018 Suns at Nuggets,21700671,2017-18,2018-01-19, Nuggets,1610612743, Suns,1610612756
01/17/2018 Nuggets at Clippers,21700662,2017-18,2018-01-17, Clippers,1610612746, Nuggets,1610612743
01/13/2018 Nuggets at Spurs,21700633,2017-18,2018-01-13, Spurs,1610612759, Nuggets,1610612743
01/12/2018 Grizzlies at Nuggets,21700625,2017-18,2018-01-12, Nuggets,1610612743, Grizzlies,1610612763
01/08/2018 Nuggets at Warriors,21700597,2017-18,2018-01-08, Warriors,1610612744, Nuggets,1610612743
01/06/2018 Nuggets at Kings,21700585,2017-18,2018-01-06, Kings,1610612758, Nuggets,1610612743
01/05/2018 Jazz at Nuggets,21700574,2017-18,2018-01-05, Nuggets,1610612743, Jazz,1610612762
01/03/2018 Suns at Nuggets,21700563,2017-18,2018-01-03, Nuggets,1610612743, Suns,1610612756
12/30/2017 76ers at Nuggets,21700536,2017-18,2017-12-30, Nuggets,1610612743, 76ers,1610612755
12/27/2017 Nuggets at Timberwolves,21700510,2017-18,2017-12-27, Timberwolves,1610612750, Nuggets,1610612743
12/26/2017 Jazz at Nuggets,21700503,2017-18,2017-12-26, Nuggets,1610612743, Jazz,1610612762
12/23/2017 Nuggets at Warriors,21700489,2017-18,2017-12-23, Warriors,1610612744, Nuggets,1610612743
12/22/2017 Nuggets at Trail Blazers,21700478,2017-18,2017-12-22, Trail Blazers,1610612757, Nuggets,1610612743
12/20/2017 Timberwolves at Nuggets,21700462,2017-18,2017-12-20, Nuggets,1610612743, Timberwolves,1610612750
12/18/2017 Nuggets at Thunder,21700447,2017-18,2017-12-18, Thunder,1610612760, Nuggets,1610612743
12/12/2017 Nuggets at Pistons,21700398,2017-18,2017-12-12, Pistons,1610612765, Nuggets,1610612743
12/10/2017 Nuggets at Pacers,21700387,2017-18,2017-12-10, Pacers,1610612754, Nuggets,1610612743
12/08/2017 Nuggets at Magic,21700370,2017-18,2017-12-08, Magic,1610612753, Nuggets,1610612743
12/02/2017 Lakers at Nuggets,21700332,2017-18,2017-12-02, Nuggets,1610612743, Lakers,1610612747
11/28/2017 Nuggets at Jazz,21700301,2017-18,2017-11-28, Jazz,1610612762, Nuggets,1610612743
11/24/2017 Grizzlies at Nuggets,21700274,2017-18,2017-11-24, Nuggets,1610612743, Grizzlies,1610612763
11/22/2017 Nuggets at Rockets,21700259,2017-18,2017-11-22, Rockets,1610612745, Nuggets,1610612743
11/20/2017 Nuggets at Kings,21700251,2017-18,2017-11-20, Kings,1610612758, Nuggets,1610612743
11/19/2017 Nuggets at Lakers,21700240,2017-18,2017-11-19, Lakers,1610612747, Nuggets,1610612743
11/13/2017 Nuggets at Trail Blazers,21700198,2017-18,2017-11-13, Trail Blazers,1610612757, Nuggets,1610612743
11/11/2017 Magic at Nuggets,21700185,2017-18,2017-11-11, Nuggets,1610612743, Magic,1610612753
11/09/2017 Thunder at Nuggets,21700168,2017-18,2017-11-09, Nuggets,1610612743, Thunder,1610612760
11/07/2017 Nets at Nuggets,21700155,2017-18,2017-11-07, Nuggets,1610612743, Nets,1610612751
11/04/2017 Warriors at Nuggets,21700135,2017-18,2017-11-04, Nuggets,1610612743, Warriors,1610612744
11/03/2017 Heat at Nuggets,21700127,2017-18,2017-11-03, Nuggets,1610612743, Heat,1610612748
11/01/2017 Raptors at Nuggets,21700114,2017-18,2017-11-01, Nuggets,1610612743, Raptors,1610612761
10/30/2017 Nuggets at Knicks,21700094,2017-18,2017-10-30, Knicks,1610612752, Nuggets,1610612743
10/29/2017 Nuggets at Nets,21700087,2017-18,2017-10-29, Nets,1610612751, Nuggets,1610612743
10/25/2017 Nuggets at Hornets,21700055,2017-18,2017-10-25, Hornets,1610612766, Nuggets,1610612743
10/23/2017 Wizards at Nuggets,21700047,2017-18,2017-10-23, Nuggets,1610612743, Wizards,1610612764
10/21/2017 Kings at Nuggets,21700035,2017-18,2017-10-21, Nuggets,1610612743, Kings,1610612758
10/18/2017 Nuggets at Jazz,21700010,2017-18,2017-10-18, Jazz,1610612762, Nuggets,1610612743
04/10/2018 Warriors at Jazz,21701217,2017-18,2018-04-10, Jazz,1610612762, Warriors,1610612744
04/08/2018 Warriors at Suns,21701203,2017-18,2018-04-08, Suns,1610612756, Warriors,1610612744
04/05/2018 Warriors at Pacers,21701175,2017-18,2018-04-05, Pacers,1610612754, Warriors,1610612744
04/03/2018 Warriors at Thunder,21701163,2017-18,2018-04-03, Thunder,1610612760, Warriors,1610612744
04/01/2018 Suns at Warriors,21701153,2017-18,2018-04-01, Warriors,1610612744, Suns,1610612756
03/31/2018 Warriors at Kings,21701142,2017-18,2018-03-31, Kings,1610612758, Warriors,1610612744
03/29/2018 Bucks at Warriors,21701128,2017-18,2018-03-29, Warriors,1610612744, Bucks,1610612749
03/27/2018 Pacers at Warriors,21701114,2017-18,2018-03-27, Warriors,1610612744, Pacers,1610612754
03/25/2018 Jazz at Warriors,21701102,2017-18,2018-03-25, Warriors,1610612744, Jazz,1610612762
03/19/2018 Warriors at Spurs,21701056,2017-18,2018-03-19, Spurs,1610612759, Warriors,1610612744
03/17/2018 Warriors at Suns,21701044,2017-18,2018-03-17, Suns,1610612756, Warriors,1610612744
03/16/2018 Kings at Warriors,21701033,2017-18,2018-03-16, Warriors,1610612744, Kings,1610612758
03/14/2018 Lakers at Warriors,21701019,2017-18,2018-03-14, Warriors,1610612744, Lakers,1610612747
03/11/2018 Warriors at Timberwolves,21700994,2017-18,2018-03-11, Timberwolves,1610612750, Warriors,1610612744
03/09/2018 Warriors at Trail Blazers,21700984,2017-18,2018-03-09, Trail Blazers,1610612757, Warriors,1610612744
03/08/2018 Spurs at Warriors,21700976,2017-18,2018-03-08, Warriors,1610612744, Spurs,1610612759
03/06/2018 Nets at Warriors,21700963,2017-18,2018-03-06, Warriors,1610612744, Nets,1610612751
02/28/2018 Warriors at Wizards,21700917,2017-18,2018-02-28, Wizards,1610612764, Warriors,1610612744
02/26/2018 Warriors at Knicks,21700900,2017-18,2018-02-26, Knicks,1610612752, Warriors,1610612744
02/24/2018 Thunder at Warriors,21700887,2017-18,2018-02-24, Warriors,1610612744, Thunder,1610612760
02/22/2018 Clippers at Warriors,21700872,2017-18,2018-02-22, Warriors,1610612744, Clippers,1610612746
02/14/2018 Warriors at Trail Blazers,21700864,2017-18,2018-02-14, Trail Blazers,1610612757, Warriors,1610612744
02/12/2018 Suns at Warriors,21700846,2017-18,2018-02-12, Warriors,1610612744, Suns,1610612756
02/10/2018 Spurs at Warriors,21700831,2017-18,2018-02-10, Warriors,1610612744, Spurs,1610612759
02/06/2018 Thunder at Warriors,21700803,2017-18,2018-02-06, Warriors,1610612744, Thunder,1610612760
02/02/2018 Warriors at Kings,21700774,2017-18,2018-02-02, Kings,1610612758, Warriors,1610612744
01/30/2018 Warriors at Jazz,21700751,2017-18,2018-01-30, Jazz,1610612762, Warriors,1610612744
01/25/2018 Timberwolves at Warriors,21700713,2017-18,2018-01-25, Warriors,1610612744, Timberwolves,1610612750
01/23/2018 Knicks at Warriors,21700699,2017-18,2018-01-23, Warriors,1610612744, Knicks,1610612752
01/20/2018 Warriors at Rockets,21700679,2017-18,2018-01-20, Rockets,1610612745, Warriors,1610612744
01/13/2018 Warriors at Raptors,21700631,2017-18,2018-01-13, Raptors,1610612761, Warriors,1610612744
01/12/2018 Warriors at Bucks,21700622,2017-18,2018-01-12, Bucks,1610612749, Warriors,1610612744
01/10/2018 Clippers at Warriors,21700613,2017-18,2018-01-10, Warriors,1610612744, Clippers,1610612746
01/06/2018 Warriors at Clippers,21700578,2017-18,2018-01-06, Clippers,1610612746, Warriors,1610612744
01/04/2018 Warriors at Rockets,21700566,2017-18,2018-01-04, Rockets,1610612745, Warriors,1610612744
12/30/2017 Grizzlies at Warriors,21700535,2017-18,2017-12-30, Warriors,1610612744, Grizzlies,1610612763
12/29/2017 Hornets at Warriors,21700528,2017-18,2017-12-29, Warriors,1610612744, Hornets,1610612766
12/27/2017 Jazz at Warriors,21700514,2017-18,2017-12-27, Warriors,1610612744, Jazz,1610612762
12/22/2017 Lakers at Warriors,21700479,2017-18,2017-12-22, Warriors,1610612744, Lakers,1610612747
12/20/2017 Grizzlies at Warriors,21700464,2017-18,2017-12-20, Warriors,1610612744, Grizzlies,1610612763
12/18/2017 Warriors at Lakers,21700450,2017-18,2017-12-18, Lakers,1610612747, Warriors,1610612744
12/11/2017 Trail Blazers at Warriors,21700395,2017-18,2017-12-11, Warriors,1610612744, Trail Blazers,1610612757
12/08/2017 Warriors at Pistons,21700368,2017-18,2017-12-08, Pistons,1610612765, Warriors,1610612744
12/06/2017 Warriors at Hornets,21700358,2017-18,2017-12-06, Hornets,1610612766, Warriors,1610612744
12/03/2017 Warriors at Heat,21700335,2017-18,2017-12-03, Heat,1610612748, Warriors,1610612744
12/01/2017 Warriors at Magic,21700318,2017-18,2017-12-01, Magic,1610612753, Warriors,1610612744
11/29/2017 Warriors at Lakers,21700312,2017-18,2017-11-29, Lakers,1610612747, Warriors,1610612744
11/27/2017 Kings at Warriors,21700296,2017-18,2017-11-27, Warriors,1610612744, Kings,1610612758
11/22/2017 Warriors at Thunder,21700263,2017-18,2017-11-22, Thunder,1610612760, Warriors,1610612744
11/19/2017 Warriors at Nets,21700236,2017-18,2017-11-19, Nets,1610612751, Warriors,1610612744
11/18/2017 Warriors at 76ers,21700231,2017-18,2017-11-18, 76ers,1610612755, Warriors,1610612744
11/13/2017 Magic at Warriors,21700199,2017-18,2017-11-13, Warriors,1610612744, Magic,1610612753
11/11/2017 76ers at Warriors,21700184,2017-18,2017-11-11, Warriors,1610612744, 76ers,1610612755
11/08/2017 Timberwolves at Warriors,21700163,2017-18,2017-11-08, Warriors,1610612744, Timberwolves,1610612750
11/06/2017 Heat at Warriors,21700148,2017-18,2017-11-06, Warriors,1610612744, Heat,1610612748
11/02/2017 Warriors at Spurs,21700117,2017-18,2017-11-02, Spurs,1610612759, Warriors,1610612744
10/30/2017 Warriors at Clippers,21700100,2017-18,2017-10-30, Clippers,1610612746, Warriors,1610612744
10/29/2017 Pistons at Warriors,21700091,2017-18,2017-10-29, Warriors,1610612744, Pistons,1610612765
10/27/2017 Wizards at Warriors,21700075,2017-18,2017-10-27, Warriors,1610612744, Wizards,1610612764
10/25/2017 Raptors at Warriors,21700063,2017-18,2017-10-25, Warriors,1610612744, Raptors,1610612761
10/21/2017 Warriors at Grizzlies,21700033,2017-18,2017-10-21, Grizzlies,1610612763, Warriors,1610612744
10/17/2017 Rockets at Warriors,21700002,2017-18,2017-10-17, Warriors,1610612744, Rockets,1610612745
04/11/2018 Rockets at Kings,21701230,2017-18,2018-04-11, Kings,1610612758, Rockets,1610612745
04/10/2018 Rockets at Lakers,21701218,2017-18,2018-04-10, Lakers,1610612747, Rockets,1610612745
04/07/2018 Thunder at Rockets,21701194,2017-18,2018-04-07, Rockets,1610612745, Thunder,1610612760
04/05/2018 Trail Blazers at Rockets,21701177,2017-18,2018-04-05, Rockets,1610612745, Trail Blazers,1610612757
04/03/2018 Wizards at Rockets,21701161,2017-18,2018-04-03, Rockets,1610612745, Wizards,1610612764
04/01/2018 Rockets at Spurs,21701145,2017-18,2018-04-01, Spurs,1610612759, Rockets,1610612745
03/30/2018 Suns at Rockets,21701132,2017-18,2018-03-30, Rockets,1610612745, Suns,1610612756
03/22/2018 Pistons at Rockets,21701074,2017-18,2018-03-22, Rockets,1610612745, Pistons,1610612765
03/20/2018 Rockets at Trail Blazers,21701064,2017-18,2018-03-20, Trail Blazers,1610612757, Rockets,1610612745
03/18/2018 Rockets at Timberwolves,21701048,2017-18,2018-03-18, Timberwolves,1610612750, Rockets,1610612745
03/15/2018 Clippers at Rockets,21701023,2017-18,2018-03-15, Rockets,1610612745, Clippers,1610612746
03/12/2018 Spurs at Rockets,21701001,2017-18,2018-03-12, Rockets,1610612745, Spurs,1610612759
03/09/2018 Rockets at Raptors,21700979,2017-18,2018-03-09, Raptors,1610612761, Rockets,1610612745
03/07/2018 Rockets at Bucks,21700968,2017-18,2018-03-07, Bucks,1610612749, Rockets,1610612745
03/06/2018 Rockets at Thunder,21700960,2017-18,2018-03-06, Thunder,1610612760, Rockets,1610612745
02/28/2018 Rockets at Clippers,21700921,2017-18,2018-02-28, Clippers,1610612746, Rockets,1610612745
02/26/2018 Rockets at Jazz,21700905,2017-18,2018-02-26, Jazz,1610612762, Rockets,1610612745
02/23/2018 Timberwolves at Rockets,21700877,2017-18,2018-02-23, Rockets,1610612745, Timberwolves,1610612750
02/14/2018 Kings at Rockets,21700860,2017-18,2018-02-14, Rockets,1610612745, Kings,1610612758
02/13/2018 Rockets at Timberwolves,21700849,2017-18,2018-02-13, Timberwolves,1610612750, Rockets,1610612745
02/07/2018 Rockets at Heat,21700806,2017-18,2018-02-07, Heat,1610612748, Rockets,1610612745
02/06/2018 Rockets at Nets,21700800,2017-18,2018-02-06, Nets,1610612751, Rockets,1610612745
02/01/2018 Rockets at Spurs,21700764,2017-18,2018-02-01, Spurs,1610612759, Rockets,1610612745
01/30/2018 Magic at Rockets,21700748,2017-18,2018-01-30, Rockets,1610612745, Magic,1610612753
01/28/2018 Suns at Rockets,21700732,2017-18,2018-01-28, Rockets,1610612745, Suns,1610612756
01/22/2018 Heat at Rockets,21700689,2017-18,2018-01-22, Rockets,1610612745, Heat,1610612748
01/18/2018 Timberwolves at Rockets,21700665,2017-18,2018-01-18, Rockets,1610612745, Timberwolves,1610612750
01/15/2018 Rockets at Clippers,21700648,2017-18,2018-01-15, Clippers,1610612746, Rockets,1610612745
01/12/2018 Rockets at Suns,21700626,2017-18,2018-01-12, Suns,1610612756, Rockets,1610612745
01/10/2018 Trail Blazers at Rockets,21700608,2017-18,2018-01-10, Rockets,1610612745, Trail Blazers,1610612757
01/06/2018 Rockets at Pistons,21700580,2017-18,2018-01-06, Pistons,1610612765, Rockets,1610612745
01/03/2018 Rockets at Magic,21700554,2017-18,2018-01-03, Magic,1610612753, Rockets,1610612745
12/31/2017 Lakers at Rockets,21700540,2017-18,2017-12-31, Rockets,1610612745, Lakers,1610612747
12/29/2017 Rockets at Wizards,21700521,2017-18,2017-12-29, Wizards,1610612764, Rockets,1610612745
12/25/2017 Rockets at Thunder,21700496,2017-18,2017-12-25, Thunder,1610612760, Rockets,1610612745
12/22/2017 Clippers at Rockets,21700475,2017-18,2017-12-22, Rockets,1610612745, Clippers,1610612746
12/20/2017 Lakers at Rockets,21700459,2017-18,2017-12-20, Rockets,1610612745, Lakers,1610612747
12/18/2017 Jazz at Rockets,21700445,2017-18,2017-12-18, Rockets,1610612745, Jazz,1610612762
12/16/2017 Bucks at Rockets,21700433,2017-18,2017-12-16, Rockets,1610612745, Bucks,1610612749
12/15/2017 Spurs at Rockets,21700428,2017-18,2017-12-15, Rockets,1610612745, Spurs,1610612759
12/13/2017 Hornets at Rockets,21700412,2017-18,2017-12-13, Rockets,1610612745, Hornets,1610612766
12/09/2017 Rockets at Trail Blazers,21700384,2017-18,2017-12-09, Trail Blazers,1610612757, Rockets,1610612745
12/07/2017 Rockets at Jazz,21700366,2017-18,2017-12-07, Jazz,1610612762, Rockets,1610612745
12/03/2017 Rockets at Lakers,21700338,2017-18,2017-12-03, Lakers,1610612747, Rockets,1610612745
11/29/2017 Pacers at Rockets,21700308,2017-18,2017-11-29, Rockets,1610612745, Pacers,1610612754
11/27/2017 Nets at Rockets,21700294,2017-18,2017-11-27, Rockets,1610612745, Nets,1610612751
11/25/2017 Knicks at Rockets,21700282,2017-18,2017-11-25, Rockets,1610612745, Knicks,1610612752
11/18/2017 Rockets at Grizzlies,21700232,2017-18,2017-11-18, Grizzlies,1610612763, Rockets,1610612745
11/16/2017 Rockets at Suns,21700216,2017-18,2017-11-16, Suns,1610612756, Rockets,1610612745
11/14/2017 Raptors at Rockets,21700202,2017-18,2017-11-14, Rockets,1610612745, Raptors,1610612761
11/12/2017 Rockets at Pacers,21700190,2017-18,2017-11-12, Pacers,1610612754, Rockets,1610612745
11/11/2017 Grizzlies at Rockets,21700180,2017-18,2017-11-11, Rockets,1610612745, Grizzlies,1610612763
11/05/2017 Jazz at Rockets,21700140,2017-18,2017-11-05, Rockets,1610612745, Jazz,1610612762
11/01/2017 Rockets at Knicks,21700111,2017-18,2017-11-01, Knicks,1610612752, Rockets,1610612745
10/30/2017 76ers at Rockets,21700095,2017-18,2017-10-30, Rockets,1610612745, 76ers,1610612755
10/28/2017 Rockets at Grizzlies,21700080,2017-18,2017-10-28, Grizzlies,1610612763, Rockets,1610612745
10/27/2017 Rockets at Hornets,21700070,2017-18,2017-10-27, Hornets,1610612766, Rockets,1610612745
10/25/2017 Rockets at 76ers,21700057,2017-18,2017-10-25, 76ers,1610612755, Rockets,1610612745
10/23/2017 Grizzlies at Rockets,21700043,2017-18,2017-10-23, Rockets,1610612745, Grizzlies,1610612763
10/18/2017 Rockets at Kings,21700013,2017-18,2017-10-18, Kings,1610612758, Rockets,1610612745
04/11/2018 Lakers at Clippers,21701228,2017-18,2018-04-11, Clippers,1610612746, Lakers,1610612747
04/05/2018 Clippers at Jazz,21701179,2017-18,2018-04-05, Jazz,1610612762, Clippers,1610612746
04/03/2018 Spurs at Clippers,21701168,2017-18,2018-04-03, Clippers,1610612746, Spurs,1610612759
04/01/2018 Pacers at Clippers,21701146,2017-18,2018-04-01, Clippers,1610612746, Pacers,1610612754
03/30/2018 Clippers at Trail Blazers,21701137,2017-18,2018-03-30, Trail Blazers,1610612757, Clippers,1610612746
03/28/2018 Clippers at Suns,21701122,2017-18,2018-03-28, Suns,1610612756, Clippers,1610612746
03/27/2018 Bucks at Clippers,21701115,2017-18,2018-03-27, Clippers,1610612746, Bucks,1610612749
03/25/2018 Clippers at Raptors,21701097,2017-18,2018-03-25, Raptors,1610612761, Clippers,1610612746
03/23/2018 Clippers at Pacers,21701078,2017-18,2018-03-23, Pacers,1610612754, Clippers,1610612746
03/21/2018 Clippers at Bucks,21701070,2017-18,2018-03-21, Bucks,1610612749, Clippers,1610612746
03/20/2018 Clippers at Timberwolves,21701060,2017-18,2018-03-20, Timberwolves,1610612750, Clippers,1610612746
03/18/2018 Trail Blazers at Clippers,21701049,2017-18,2018-03-18, Clippers,1610612746, Trail Blazers,1610612757
03/16/2018 Clippers at Thunder,21701032,2017-18,2018-03-16, Thunder,1610612760, Clippers,1610612746
03/10/2018 Magic at Clippers,21700991,2017-18,2018-03-10, Clippers,1610612746, Magic,1610612753
03/04/2018 Nets at Clippers,21700948,2017-18,2018-03-04, Clippers,1610612746, Nets,1610612751
03/02/2018 Knicks at Clippers,21700935,2017-18,2018-03-02, Clippers,1610612746, Knicks,1610612752
02/23/2018 Clippers at Suns,21700881,2017-18,2018-02-23, Suns,1610612756, Clippers,1610612746
02/12/2018 Clippers at Nets,21700843,2017-18,2018-02-12, Nets,1610612751, Clippers,1610612746
02/10/2018 Clippers at 76ers,21700828,2017-18,2018-02-10, 76ers,1610612755, Clippers,1610612746
02/09/2018 Clippers at Pistons,21700817,2017-18,2018-02-09, Pistons,1610612765, Clippers,1610612746
01/30/2018 Trail Blazers at Clippers,21700752,2017-18,2018-01-30, Clippers,1610612746, Trail Blazers,1610612757
01/26/2018 Clippers at Grizzlies,21700718,2017-18,2018-01-26, Grizzlies,1610612763, Clippers,1610612746
01/22/2018 Timberwolves at Clippers,21700695,2017-18,2018-01-22, Clippers,1610612746, Timberwolves,1610612750
01/20/2018 Clippers at Jazz,21700681,2017-18,2018-01-20, Jazz,1610612762, Clippers,1610612746
01/13/2018 Kings at Clippers,21700628,2017-18,2018-01-13, Clippers,1610612746, Kings,1610612758
01/11/2018 Clippers at Kings,21700616,2017-18,2018-01-11, Kings,1610612758, Clippers,1610612746
01/04/2018 Thunder at Clippers,21700567,2017-18,2018-01-04, Clippers,1610612746, Thunder,1610612760
01/02/2018 Grizzlies at Clippers,21700553,2017-18,2018-01-02, Clippers,1610612746, Grizzlies,1610612763
12/31/2017 Hornets at Clippers,21700542,2017-18,2017-12-31, Clippers,1610612746, Hornets,1610612766
12/29/2017 Clippers at Lakers,21700529,2017-18,2017-12-29, Lakers,1610612747, Clippers,1610612746
12/26/2017 Kings at Clippers,21700505,2017-18,2017-12-26, Clippers,1610612746, Kings,1610612758
12/23/2017 Clippers at Grizzlies,21700487,2017-18,2017-12-23, Grizzlies,1610612763, Clippers,1610612746
12/20/2017 Suns at Clippers,21700465,2017-18,2017-12-20, Clippers,1610612746, Suns,1610612756
12/18/2017 Clippers at Spurs,21700449,2017-18,2017-12-18, Spurs,1610612759, Clippers,1610612746
12/16/2017 Clippers at Heat,21700432,2017-18,2017-12-16, Heat,1610612748, Clippers,1610612746
12/15/2017 Clippers at Wizards,21700422,2017-18,2017-12-15, Wizards,1610612764, Clippers,1610612746
12/13/2017 Clippers at Magic,21700405,2017-18,2017-12-13, Magic,1610612753, Clippers,1610612746
12/11/2017 Raptors at Clippers,21700396,2017-18,2017-12-11, Clippers,1610612746, Raptors,1610612761
12/09/2017 Wizards at Clippers,21700375,2017-18,2017-12-09, Clippers,1610612746, Wizards,1610612764
12/06/2017 Timberwolves at Clippers,21700362,2017-18,2017-12-06, Clippers,1610612746, Timberwolves,1610612750
12/03/2017 Clippers at Timberwolves,21700336,2017-18,2017-12-03, Timberwolves,1610612750, Clippers,1610612746
11/30/2017 Jazz at Clippers,21700317,2017-18,2017-11-30, Clippers,1610612746, Jazz,1610612762
11/27/2017 Lakers at Clippers,21700297,2017-18,2017-11-27, Clippers,1610612746, Lakers,1610612747
11/25/2017 Clippers at Kings,21700286,2017-18,2017-11-25, Kings,1610612758, Clippers,1610612746
11/20/2017 Clippers at Knicks,21700245,2017-18,2017-11-20, Knicks,1610612752, Clippers,1610612746
11/18/2017 Clippers at Hornets,21700228,2017-18,2017-11-18, Hornets,1610612766, Clippers,1610612746
11/13/2017 76ers at Clippers,21700200,2017-18,2017-11-13, Clippers,1610612746, 76ers,1610612755
11/10/2017 Clippers at Thunder,21700172,2017-18,2017-11-10, Thunder,1610612760, Clippers,1610612746
11/07/2017 Clippers at Spurs,21700154,2017-18,2017-11-07, Spurs,1610612759, Clippers,1610612746
11/05/2017 Heat at Clippers,21700137,2017-18,2017-11-05, Clippers,1610612746, Heat,1610612748
11/04/2017 Grizzlies at Clippers,21700131,2017-18,2017-11-04, Clippers,1610612746, Grizzlies,1610612763
10/28/2017 Pistons at Clippers,21700084,2017-18,2017-10-28, Clippers,1610612746, Pistons,1610612765
10/26/2017 Clippers at Trail Blazers,21700068,2017-18,2017-10-26, Trail Blazers,1610612757, Clippers,1610612746
10/24/2017 Jazz at Clippers,21700054,2017-18,2017-10-24, Clippers,1610612746, Jazz,1610612762
10/21/2017 Suns at Clippers,21700037,2017-18,2017-10-21, Clippers,1610612746, Suns,1610612756
10/19/2017 Clippers at Lakers,21700016,2017-18,2017-10-19, Lakers,1610612747, Clippers,1610612746
04/08/2018 Jazz at Lakers,21701201,2017-18,2018-04-08, Lakers,1610612747, Jazz,1610612762
04/06/2018 Timberwolves at Lakers,21701190,2017-18,2018-04-06, Lakers,1610612747, Timberwolves,1610612750
04/04/2018 Spurs at Lakers,21701174,2017-18,2018-04-04, Lakers,1610612747, Spurs,1610612759
04/03/2018 Lakers at Jazz,21701166,2017-18,2018-04-03, Jazz,1610612762, Lakers,1610612747
04/01/2018 Kings at Lakers,21701155,2017-18,2018-04-01, Lakers,1610612747, Kings,1610612758
03/30/2018 Bucks at Lakers,21701136,2017-18,2018-03-30, Lakers,1610612747, Bucks,1610612749
03/26/2018 Lakers at Pistons,21701104,2017-18,2018-03-26, Pistons,1610612765, Lakers,1610612747
03/24/2018 Lakers at Grizzlies,21701092,2017-18,2018-03-24, Grizzlies,1610612763, Lakers,1610612747
03/19/2018 Lakers at Pacers,21701051,2017-18,2018-03-19, Pacers,1610612754, Lakers,1610612747
03/16/2018 Heat at Lakers,21701034,2017-18,2018-03-16, Lakers,1610612747, Heat,1610612748
03/07/2018 Magic at Lakers,21700971,2017-18,2018-03-07, Lakers,1610612747, Magic,1610612753
03/05/2018 Trail Blazers at Lakers,21700956,2017-18,2018-03-05, Lakers,1610612747, Trail Blazers,1610612757
03/03/2018 Lakers at Spurs,21700940,2017-18,2018-03-03, Spurs,1610612759, Lakers,1610612747
03/01/2018 Lakers at Heat,21700922,2017-18,2018-03-01, Heat,1610612748, Lakers,1610612747
02/24/2018 Lakers at Kings,21700891,2017-18,2018-02-24, Kings,1610612758, Lakers,1610612747
02/15/2018 Lakers at Timberwolves,21700866,2017-18,2018-02-15, Timberwolves,1610612750, Lakers,1610612747
02/08/2018 Thunder at Lakers,21700816,2017-18,2018-02-08, Lakers,1610612747, Thunder,1610612760
02/06/2018 Suns at Lakers,21700804,2017-18,2018-02-06, Lakers,1610612747, Suns,1610612756
02/04/2018 Lakers at Thunder,21700788,2017-18,2018-02-04, Thunder,1610612760, Lakers,1610612747
02/02/2018 Lakers at Nets,21700768,2017-18,2018-02-02, Nets,1610612751, Lakers,1610612747
01/31/2018 Lakers at Magic,21700754,2017-18,2018-01-31, Magic,1610612753, Lakers,1610612747
01/28/2018 Lakers at Raptors,21700735,2017-18,2018-01-28, Raptors,1610612761, Lakers,1610612747
01/21/2018 Knicks at Lakers,21700684,2017-18,2018-01-21, Lakers,1610612747, Knicks,1610612752
01/19/2018 Pacers at Lakers,21700673,2017-18,2018-01-19, Lakers,1610612747, Pacers,1610612754
01/17/2018 Lakers at Thunder,21700660,2017-18,2018-01-17, Thunder,1610612760, Lakers,1610612747
01/15/2018 Lakers at Grizzlies,21700645,2017-18,2018-01-15, Grizzlies,1610612763, Lakers,1610612747
01/11/2018 Spurs at Lakers,21700617,2017-18,2018-01-11, Lakers,1610612747, Spurs,1610612759
01/09/2018 Kings at Lakers,21700602,2017-18,2018-01-09, Lakers,1610612747, Kings,1610612758
01/05/2018 Hornets at Lakers,21700577,2017-18,2018-01-05, Lakers,1610612747, Hornets,1610612766
01/03/2018 Thunder at Lakers,21700565,2017-18,2018-01-03, Lakers,1610612747, Thunder,1610612760
01/01/2018 Lakers at Timberwolves,21700548,2017-18,2018-01-01, Timberwolves,1610612750, Lakers,1610612747
12/27/2017 Grizzlies at Lakers,21700515,2017-18,2017-12-27, Lakers,1610612747, Grizzlies,1610612763
12/25/2017 Timberwolves at Lakers,21700497,2017-18,2017-12-25, Lakers,1610612747, Timberwolves,1610612750
12/23/2017 Trail Blazers at Lakers,21700491,2017-18,2017-12-23, Lakers,1610612747, Trail Blazers,1610612757
12/12/2017 Lakers at Knicks,21700399,2017-18,2017-12-12, Knicks,1610612752, Lakers,1610612747
12/09/2017 Lakers at Hornets,21700377,2017-18,2017-12-09, Hornets,1610612766, Lakers,1610612747
12/07/2017 Lakers at 76ers,21700363,2017-18,2017-12-07, 76ers,1610612755, Lakers,1610612747
11/22/2017 Lakers at Kings,21700266,2017-18,2017-11-22, Kings,1610612758, Lakers,1610612747
11/17/2017 Suns at Lakers,21700227,2017-18,2017-11-17, Lakers,1610612747, Suns,1610612756
11/15/2017 76ers at Lakers,21700214,2017-18,2017-11-15, Lakers,1610612747, 76ers,1610612755
11/13/2017 Lakers at Suns,21700196,2017-18,2017-11-13, Suns,1610612756, Lakers,1610612747
11/11/2017 Lakers at Bucks,21700182,2017-18,2017-11-11, Bucks,1610612749, Lakers,1610612747
11/09/2017 Lakers at Wizards,21700164,2017-18,2017-11-09, Wizards,1610612764, Lakers,1610612747
11/05/2017 Grizzlies at Lakers,21700145,2017-18,2017-11-05, Lakers,1610612747, Grizzlies,1610612763
11/03/2017 Nets at Lakers,21700130,2017-18,2017-11-03, Lakers,1610612747, Nets,1610612751
11/02/2017 Lakers at Trail Blazers,21700118,2017-18,2017-11-02, Trail Blazers,1610612757, Lakers,1610612747
10/31/2017 Pistons at Lakers,21700104,2017-18,2017-10-31, Lakers,1610612747, Pistons,1610612765
10/28/2017 Lakers at Jazz,21700082,2017-18,2017-10-28, Jazz,1610612762, Lakers,1610612747
10/27/2017 Raptors at Lakers,21700076,2017-18,2017-10-27, Lakers,1610612747, Raptors,1610612761
10/25/2017 Wizards at Lakers,21700064,2017-18,2017-10-25, Lakers,1610612747, Wizards,1610612764
10/20/2017 Lakers at Suns,21700026,2017-18,2017-10-20, Suns,1610612756, Lakers,1610612747
04/11/2018 Raptors at Heat,21701221,2017-18,2018-04-11, Heat,1610612748, Raptors,1610612761
04/09/2018 Thunder at Heat,21701206,2017-18,2018-04-09, Heat,1610612748, Thunder,1610612760
04/06/2018 Heat at Knicks,21701186,2017-18,2018-04-06, Knicks,1610612752, Heat,1610612748
03/31/2018 Nets at Heat,21701141,2017-18,2018-03-31, Heat,1610612748, Nets,1610612751
03/25/2018 Heat at Pacers,21701096,2017-18,2018-03-25, Pacers,1610612754, Heat,1610612748
03/23/2018 Heat at Thunder,21701084,2017-18,2018-03-23, Thunder,1610612760, Heat,1610612748
03/21/2018 Knicks at Heat,21701068,2017-18,2018-03-21, Heat,1610612748, Knicks,1610612752
03/14/2018 Heat at Kings,21701018,2017-18,2018-03-14, Kings,1610612758, Heat,1610612748
03/12/2018 Heat at Trail Blazers,21701004,2017-18,2018-03-12, Trail Blazers,1610612757, Heat,1610612748
03/10/2018 Wizards at Heat,21700988,2017-18,2018-03-10, Heat,1610612748, Wizards,1610612764
03/08/2018 76ers at Heat,21700973,2017-18,2018-03-08, Heat,1610612748, 76ers,1610612755
03/06/2018 Heat at Wizards,21700959,2017-18,2018-03-06, Wizards,1610612764, Heat,1610612748
03/05/2018 Suns at Heat,21700952,2017-18,2018-03-05, Heat,1610612748, Suns,1610612756
03/03/2018 Pistons at Heat,21700938,2017-18,2018-03-03, Heat,1610612748, Pistons,1610612765
02/27/2018 76ers at Heat,21700909,2017-18,2018-02-27, Heat,1610612748, 76ers,1610612755
02/24/2018 Grizzlies at Heat,21700885,2017-18,2018-02-24, Heat,1610612748, Grizzlies,1610612763
02/14/2018 Heat at 76ers,21700855,2017-18,2018-02-14, 76ers,1610612755, Heat,1610612748
02/13/2018 Heat at Raptors,21700847,2017-18,2018-02-13, Raptors,1610612761, Heat,1610612748
02/09/2018 Bucks at Heat,21700821,2017-18,2018-02-09, Heat,1610612748, Bucks,1610612749
02/05/2018 Magic at Heat,21700792,2017-18,2018-02-05, Heat,1610612748, Magic,1610612753
02/03/2018 Heat at Pistons,21700776,2017-18,2018-02-03, Pistons,1610612765, Heat,1610612748
02/02/2018 Heat at 76ers,21700770,2017-18,2018-02-02, 76ers,1610612755, Heat,1610612748
01/27/2018 Hornets at Heat,21700727,2017-18,2018-01-27, Heat,1610612748, Hornets,1610612766
01/25/2018 Kings at Heat,21700710,2017-18,2018-01-25, Heat,1610612748, Kings,1610612758
01/20/2018 Heat at Hornets,21700676,2017-18,2018-01-20, Hornets,1610612766, Heat,1610612748
01/19/2018 Heat at Nets,21700668,2017-18,2018-01-19, Nets,1610612751, Heat,1610612748
01/17/2018 Heat at Bucks,21700659,2017-18,2018-01-17, Bucks,1610612749, Heat,1610612748
01/14/2018 Bucks at Heat,21700634,2017-18,2018-01-14, Heat,1610612748, Bucks,1610612749
01/10/2018 Heat at Pacers,21700604,2017-18,2018-01-10, Pacers,1610612754, Heat,1610612748
01/09/2018 Heat at Raptors,21700599,2017-18,2018-01-09, Raptors,1610612761, Heat,1610612748
01/07/2018 Jazz at Heat,21700586,2017-18,2018-01-07, Heat,1610612748, Jazz,1610612762
01/05/2018 Knicks at Heat,21700568,2017-18,2018-01-05, Heat,1610612748, Knicks,1610612752
01/03/2018 Pistons at Heat,21700558,2017-18,2018-01-03, Heat,1610612748, Pistons,1610612765
12/30/2017 Heat at Magic,21700531,2017-18,2017-12-30, Magic,1610612753, Heat,1610612748
12/29/2017 Nets at Heat,21700523,2017-18,2017-12-29, Heat,1610612748, Nets,1610612751
12/26/2017 Magic at Heat,21700500,2017-18,2017-12-26, Heat,1610612748, Magic,1610612753
12/15/2017 Heat at Hornets,21700418,2017-18,2017-12-15, Hornets,1610612766, Heat,1610612748
12/13/2017 Trail Blazers at Heat,21700408,2017-18,2017-12-13, Heat,1610612748, Trail Blazers,1610612757
12/11/2017 Heat at Grizzlies,21700393,2017-18,2017-12-11, Grizzlies,1610612763, Heat,1610612748
12/09/2017 Heat at Nets,21700376,2017-18,2017-12-09, Nets,1610612751, Heat,1610612748
12/06/2017 Heat at Spurs,21700361,2017-18,2017-12-06, Spurs,1610612759, Heat,1610612748
12/01/2017 Hornets at Heat,21700321,2017-18,2017-12-01, Heat,1610612748, Hornets,1610612766
11/29/2017 Heat at Knicks,21700306,2017-18,2017-11-29, Knicks,1610612752, Heat,1610612748
11/24/2017 Heat at Timberwolves,21700272,2017-18,2017-11-24, Timberwolves,1610612750, Heat,1610612748
11/19/2017 Pacers at Heat,21700235,2017-18,2017-11-19, Heat,1610612748, Pacers,1610612754
11/17/2017 Heat at Wizards,21700218,2017-18,2017-11-17, Wizards,1610612764, Heat,1610612748
11/15/2017 Wizards at Heat,21700205,2017-18,2017-11-15, Heat,1610612748, Wizards,1610612764
11/12/2017 Heat at Pistons,21700189,2017-18,2017-11-12, Pistons,1610612765, Heat,1610612748
11/10/2017 Heat at Jazz,21700175,2017-18,2017-11-10, Jazz,1610612762, Heat,1610612748
11/08/2017 Heat at Suns,21700162,2017-18,2017-11-08, Suns,1610612756, Heat,1610612748
10/30/2017 Timberwolves at Heat,21700093,2017-18,2017-10-30, Heat,1610612748, Timberwolves,1610612750
10/25/2017 Spurs at Heat,21700059,2017-18,2017-10-25, Heat,1610612748, Spurs,1610612759
10/21/2017 Pacers at Heat,21700029,2017-18,2017-10-21, Heat,1610612748, Pacers,1610612754
10/18/2017 Heat at Magic,21700005,2017-18,2017-10-18, Magic,1610612753, Heat,1610612748
04/11/2018 Bucks at 76ers,21701223,2017-18,2018-04-11, 76ers,1610612755, Bucks,1610612749
04/09/2018 Magic at Bucks,21701208,2017-18,2018-04-09, Bucks,1610612749, Magic,1610612753
04/07/2018 Bucks at Knicks,21701192,2017-18,2018-04-07, Knicks,1610612752, Bucks,1610612749
04/05/2018 Nets at Bucks,21701178,2017-18,2018-04-05, Bucks,1610612749, Nets,1610612751
03/25/2018 Spurs at Bucks,21701095,2017-18,2018-03-25, Bucks,1610612749, Spurs,1610612759
03/14/2018 Bucks at Magic,21701016,2017-18,2018-03-14, Magic,1610612753, Bucks,1610612749
03/12/2018 Bucks at Grizzlies,21701002,2017-18,2018-03-12, Grizzlies,1610612763, Bucks,1610612749
03/09/2018 Knicks at Bucks,21700981,2017-18,2018-03-09, Bucks,1610612749, Knicks,1610612752
03/05/2018 Bucks at Pacers,21700951,2017-18,2018-03-05, Pacers,1610612754, Bucks,1610612749
03/04/2018 76ers at Bucks,21700947,2017-18,2018-03-04, Bucks,1610612749, 76ers,1610612755
03/02/2018 Pacers at Bucks,21700932,2017-18,2018-03-02, Bucks,1610612749, Pacers,1610612754
02/28/2018 Bucks at Pistons,21700913,2017-18,2018-02-28, Pistons,1610612765, Bucks,1610612749
02/27/2018 Wizards at Bucks,21700910,2017-18,2018-02-27, Bucks,1610612749, Wizards,1610612764
02/23/2018 Bucks at Raptors,21700876,2017-18,2018-02-23, Raptors,1610612761, Bucks,1610612749
02/10/2018 Bucks at Magic,21700827,2017-18,2018-02-10, Magic,1610612753, Bucks,1610612749
02/06/2018 Bucks at Knicks,21700801,2017-18,2018-02-06, Knicks,1610612752, Bucks,1610612749
02/04/2018 Bucks at Nets,21700785,2017-18,2018-02-04, Nets,1610612751, Bucks,1610612749
02/02/2018 Knicks at Bucks,21700771,2017-18,2018-02-02, Bucks,1610612749, Knicks,1610612752
02/01/2018 Bucks at Timberwolves,21700763,2017-18,2018-02-01, Timberwolves,1610612750, Bucks,1610612749
01/29/2018 76ers at Bucks,21700741,2017-18,2018-01-29, Bucks,1610612749, 76ers,1610612755
01/26/2018 Nets at Bucks,21700719,2017-18,2018-01-26, Bucks,1610612749, Nets,1610612751
01/22/2018 Suns at Bucks,21700691,2017-18,2018-01-22, Bucks,1610612749, Suns,1610612756
01/20/2018 Bucks at 76ers,21700678,2017-18,2018-01-20, 76ers,1610612755, Bucks,1610612749
01/15/2018 Bucks at Wizards,21700640,2017-18,2018-01-15, Wizards,1610612764, Bucks,1610612749
01/10/2018 Magic at Bucks,21700610,2017-18,2018-01-10, Bucks,1610612749, Magic,1610612753
01/08/2018 Bucks at Pacers,21700591,2017-18,2018-01-08, Pacers,1610612754, Bucks,1610612749
01/06/2018 Bucks at Wizards,21700583,2017-18,2018-01-06, Wizards,1610612764, Bucks,1610612749
01/05/2018 Raptors at Bucks,21700571,2017-18,2018-01-05, Bucks,1610612749, Raptors,1610612761
01/03/2018 Pacers at Bucks,21700561,2017-18,2018-01-03, Bucks,1610612749, Pacers,1610612754
01/01/2018 Bucks at Raptors,21700546,2017-18,2018-01-01, Raptors,1610612761, Bucks,1610612749
12/29/2017 Bucks at Thunder,21700526,2017-18,2017-12-29, Thunder,1610612760, Bucks,1610612749
12/28/2017 Timberwolves at Bucks,21700518,2017-18,2017-12-28, Bucks,1610612749, Timberwolves,1610612750
12/23/2017 Bucks at Hornets,21700481,2017-18,2017-12-23, Hornets,1610612766, Bucks,1610612749
12/22/2017 Hornets at Bucks,21700476,2017-18,2017-12-22, Bucks,1610612749, Hornets,1610612766
12/09/2017 Jazz at Bucks,21700381,2017-18,2017-12-09, Bucks,1610612749, Jazz,1610612762
12/06/2017 Pistons at Bucks,21700359,2017-18,2017-12-06, Bucks,1610612749, Pistons,1610612765
12/02/2017 Kings at Bucks,21700331,2017-18,2017-12-02, Bucks,1610612749, Kings,1610612758
11/30/2017 Bucks at Trail Blazers,21700316,2017-18,2017-11-30, Trail Blazers,1610612757, Bucks,1610612749
11/28/2017 Bucks at Kings,21700302,2017-18,2017-11-28, Kings,1610612758, Bucks,1610612749
11/25/2017 Bucks at Jazz,21700285,2017-18,2017-11-25, Jazz,1610612762, Bucks,1610612749
11/22/2017 Bucks at Suns,21700264,2017-18,2017-11-22, Suns,1610612756, Bucks,1610612749
11/20/2017 Wizards at Bucks,21700247,2017-18,2017-11-20, Bucks,1610612749, Wizards,1610612764
11/15/2017 Pistons at Bucks,21700209,2017-18,2017-11-15, Bucks,1610612749, Pistons,1610612765
11/13/2017 Grizzlies at Bucks,21700194,2017-18,2017-11-13, Bucks,1610612749, Grizzlies,1610612763
11/10/2017 Bucks at Spurs,21700173,2017-18,2017-11-10, Spurs,1610612759, Bucks,1610612749
11/03/2017 Bucks at Pistons,21700119,2017-18,2017-11-03, Pistons,1610612765, Bucks,1610612749
11/01/2017 Bucks at Hornets,21700105,2017-18,2017-11-01, Hornets,1610612766, Bucks,1610612749
10/31/2017 Thunder at Bucks,21700103,2017-18,2017-10-31, Bucks,1610612749, Thunder,1610612760
10/23/2017 Hornets at Bucks,21700044,2017-18,2017-10-23, Bucks,1610612749, Hornets,1610612766
10/21/2017 Trail Blazers at Bucks,21700034,2017-18,2017-10-21, Bucks,1610612749, Trail Blazers,1610612757
04/09/2018 Grizzlies at Timberwolves,21701209,2017-18,2018-04-09, Timberwolves,1610612750, Grizzlies,1610612763
04/01/2018 Jazz at Timberwolves,21701151,2017-18,2018-04-01, Timberwolves,1610612750, Jazz,1610612762
03/26/2018 Grizzlies at Timberwolves,21701106,2017-18,2018-03-26, Timberwolves,1610612750, Grizzlies,1610612763
03/24/2018 Timberwolves at 76ers,21701088,2017-18,2018-03-24, 76ers,1610612755, Timberwolves,1610612750
03/23/2018 Timberwolves at Knicks,21701081,2017-18,2018-03-23, Knicks,1610612752, Timberwolves,1610612750
03/17/2018 Timberwolves at Spurs,21701042,2017-18,2018-03-17, Spurs,1610612759, Timberwolves,1610612750
03/13/2018 Timberwolves at Wizards,21701006,2017-18,2018-03-13, Wizards,1610612764, Timberwolves,1610612750
03/02/2018 Timberwolves at Jazz,21700934,2017-18,2018-03-02, Jazz,1610612762, Timberwolves,1610612750
03/01/2018 Timberwolves at Trail Blazers,21700925,2017-18,2018-03-01, Trail Blazers,1610612757, Timberwolves,1610612750
02/26/2018 Timberwolves at Kings,21700906,2017-18,2018-02-26, Kings,1610612758, Timberwolves,1610612750
02/11/2018 Kings at Timberwolves,21700838,2017-18,2018-02-11, Timberwolves,1610612750, Kings,1610612758
01/30/2018 Timberwolves at Raptors,21700746,2017-18,2018-01-30, Raptors,1610612761, Timberwolves,1610612750
01/27/2018 Nets at Timberwolves,21700729,2017-18,2018-01-27, Timberwolves,1610612750, Nets,1610612751
01/24/2018 Timberwolves at Trail Blazers,21700708,2017-18,2018-01-24, Trail Blazers,1610612757, Timberwolves,1610612750
01/20/2018 Raptors at Timberwolves,21700680,2017-18,2018-01-20, Timberwolves,1610612750, Raptors,1610612761
01/16/2018 Timberwolves at Magic,21700649,2017-18,2018-01-16, Magic,1610612753, Timberwolves,1610612750
01/14/2018 Trail Blazers at Timberwolves,21700637,2017-18,2018-01-14, Timberwolves,1610612750, Trail Blazers,1610612757
01/12/2018 Knicks at Timberwolves,21700623,2017-18,2018-01-12, Timberwolves,1610612750, Knicks,1610612752
01/10/2018 Thunder at Timberwolves,21700611,2017-18,2018-01-10, Timberwolves,1610612750, Thunder,1610612760
01/03/2018 Timberwolves at Nets,21700557,2017-18,2018-01-03, Nets,1610612751, Timberwolves,1610612750
12/31/2017 Timberwolves at Pacers,21700538,2017-18,2017-12-31, Pacers,1610612754, Timberwolves,1610612750
12/23/2017 Timberwolves at Suns,21700490,2017-18,2017-12-23, Suns,1610612756, Timberwolves,1610612750
12/18/2017 Trail Blazers at Timberwolves,21700446,2017-18,2017-12-18, Timberwolves,1610612750, Trail Blazers,1610612757
12/16/2017 Suns at Timberwolves,21700434,2017-18,2017-12-16, Timberwolves,1610612750, Suns,1610612756
12/14/2017 Kings at Timberwolves,21700416,2017-18,2017-12-14, Timberwolves,1610612750, Kings,1610612758
12/12/2017 76ers at Timberwolves,21700401,2017-18,2017-12-12, Timberwolves,1610612750, 76ers,1610612755
12/04/2017 Timberwolves at Grizzlies,21700345,2017-18,2017-12-04, Grizzlies,1610612763, Timberwolves,1610612750
12/01/2017 Timberwolves at Thunder,21700324,2017-18,2017-12-01, Thunder,1610612760, Timberwolves,1610612750
11/28/2017 Wizards at Timberwolves,21700300,2017-18,2017-11-28, Timberwolves,1610612750, Wizards,1610612764
11/26/2017 Suns at Timberwolves,21700288,2017-18,2017-11-26, Timberwolves,1610612750, Suns,1610612756
11/22/2017 Magic at Timberwolves,21700261,2017-18,2017-11-22, Timberwolves,1610612750, Magic,1610612753
11/20/2017 Timberwolves at Hornets,21700241,2017-18,2017-11-20, Hornets,1610612766, Timberwolves,1610612750
11/19/2017 Pistons at Timberwolves,21700238,2017-18,2017-11-19, Timberwolves,1610612750, Pistons,1610612765
11/15/2017 Spurs at Timberwolves,21700210,2017-18,2017-11-15, Timberwolves,1610612750, Spurs,1610612759
11/13/2017 Timberwolves at Jazz,21700197,2017-18,2017-11-13, Jazz,1610612762, Timberwolves,1610612750
11/11/2017 Timberwolves at Suns,21700186,2017-18,2017-11-11, Suns,1610612756, Timberwolves,1610612750
11/05/2017 Hornets at Timberwolves,21700143,2017-18,2017-11-05, Timberwolves,1610612750, Hornets,1610612766
10/27/2017 Thunder at Timberwolves,21700074,2017-18,2017-10-27, Timberwolves,1610612750, Thunder,1610612760
10/25/2017 Timberwolves at Pistons,21700056,2017-18,2017-10-25, Pistons,1610612765, Timberwolves,1610612750
10/24/2017 Pacers at Timberwolves,21700052,2017-18,2017-10-24, Timberwolves,1610612750, Pacers,1610612754
10/22/2017 Timberwolves at Thunder,21700039,2017-18,2017-10-22, Thunder,1610612760, Timberwolves,1610612750
10/20/2017 Jazz at Timberwolves,21700023,2017-18,2017-10-20, Timberwolves,1610612750, Jazz,1610612762
10/18/2017 Timberwolves at Spurs,21700011,2017-18,2017-10-18, Spurs,1610612759, Timberwolves,1610612750
04/03/2018 Nets at 76ers,21701157,2017-18,2018-04-03, 76ers,1610612755, Nets,1610612751
04/01/2018 Pistons at Nets,21701148,2017-18,2018-04-01, Nets,1610612751, Pistons,1610612765
03/28/2018 Nets at Magic,21701117,2017-18,2018-03-28, Magic,1610612753, Nets,1610612751
03/23/2018 Nets at Raptors,21701082,2017-18,2018-03-23, Raptors,1610612761, Nets,1610612751
03/21/2018 Hornets at Nets,21701067,2017-18,2018-03-21, Nets,1610612751, Hornets,1610612766
03/19/2018 Grizzlies at Nets,21701053,2017-18,2018-03-19, Nets,1610612751, Grizzlies,1610612763
03/16/2018 Nets at 76ers,21701030,2017-18,2018-03-16, 76ers,1610612755, Nets,1610612751
03/13/2018 Raptors at Nets,21701008,2017-18,2018-03-13, Nets,1610612751, Raptors,1610612761
03/11/2018 76ers at Nets,21700999,2017-18,2018-03-11, Nets,1610612751, 76ers,1610612755
03/08/2018 Nets at Hornets,21700972,2017-18,2018-03-08, Hornets,1610612766, Nets,1610612751
03/01/2018 Nets at Kings,21700924,2017-18,2018-03-01, Kings,1610612758, Nets,1610612751
02/22/2018 Nets at Hornets,21700867,2017-18,2018-02-22, Hornets,1610612766, Nets,1610612751
02/14/2018 Pacers at Nets,21700856,2017-18,2018-02-14, Nets,1610612751, Pacers,1610612754
02/07/2018 Nets at Pistons,21700805,2017-18,2018-02-07, Pistons,1610612765, Nets,1610612751
01/31/2018 76ers at Nets,21700756,2017-18,2018-01-31, Nets,1610612751, 76ers,1610612755
01/30/2018 Nets at Knicks,21700745,2017-18,2018-01-30, Knicks,1610612752, Nets,1610612751
01/23/2018 Nets at Thunder,21700697,2017-18,2018-01-23, Thunder,1610612760, Nets,1610612751
01/21/2018 Nets at Pistons,21700685,2017-18,2018-01-21, Pistons,1610612765, Nets,1610612751
01/17/2018 Spurs at Nets,21700655,2017-18,2018-01-17, Nets,1610612751, Spurs,1610612759
01/15/2018 Knicks at Nets,21700642,2017-18,2018-01-15, Nets,1610612751, Knicks,1610612752
01/13/2018 Nets at Wizards,21700630,2017-18,2018-01-13, Wizards,1610612764, Nets,1610612751
01/10/2018 Pistons at Nets,21700606,2017-18,2018-01-10, Nets,1610612751, Pistons,1610612765
01/08/2018 Raptors at Nets,21700592,2017-18,2018-01-08, Nets,1610612751, Raptors,1610612761
01/01/2018 Magic at Nets,21700545,2017-18,2018-01-01, Nets,1610612751, Magic,1610612753
12/26/2017 Nets at Spurs,21700502,2017-18,2017-12-26, Spurs,1610612759, Nets,1610612751
12/23/2017 Nets at Pacers,21700482,2017-18,2017-12-23, Pacers,1610612754, Nets,1610612751
12/22/2017 Wizards at Nets,21700473,2017-18,2017-12-22, Nets,1610612751, Wizards,1610612764
12/20/2017 Kings at Nets,21700457,2017-18,2017-12-20, Nets,1610612751, Kings,1610612758
12/17/2017 Pacers at Nets,21700439,2017-18,2017-12-17, Nets,1610612751, Pacers,1610612754
12/15/2017 Nets at Raptors,21700424,2017-18,2017-12-15, Raptors,1610612761, Nets,1610612751
12/14/2017 Knicks at Nets,21700414,2017-18,2017-12-14, Nets,1610612751, Knicks,1610612752
12/12/2017 Wizards at Nets,21700400,2017-18,2017-12-12, Nets,1610612751, Wizards,1610612764
12/07/2017 Thunder at Nets,21700365,2017-18,2017-12-07, Nets,1610612751, Thunder,1610612760
11/26/2017 Nets at Grizzlies,21700289,2017-18,2017-11-26, Grizzlies,1610612763, Nets,1610612751
11/24/2017 Trail Blazers at Nets,21700267,2017-18,2017-11-24, Nets,1610612751, Trail Blazers,1610612757
11/17/2017 Jazz at Nets,21700219,2017-18,2017-11-17, Nets,1610612751, Jazz,1610612762
11/11/2017 Nets at Jazz,21700187,2017-18,2017-11-11, Jazz,1610612762, Nets,1610612751
11/10/2017 Nets at Trail Blazers,21700176,2017-18,2017-11-10, Trail Blazers,1610612757, Nets,1610612751
11/06/2017 Nets at Suns,21700147,2017-18,2017-11-06, Suns,1610612756, Nets,1610612751
10/31/2017 Suns at Nets,21700102,2017-18,2017-10-31, Nets,1610612751, Suns,1610612756
10/27/2017 Nets at Knicks,21700073,2017-18,2017-10-27, Knicks,1610612752, Nets,1610612751
10/24/2017 Nets at Magic,21700050,2017-18,2017-10-24, Magic,1610612753, Nets,1610612751
10/20/2017 Magic at Nets,21700022,2017-18,2017-10-20, Nets,1610612751, Magic,1610612753
10/18/2017 Nets at Pacers,21700004,2017-18,2017-10-18, Pacers,1610612754, Nets,1610612751
04/03/2018 Magic at Knicks,21701159,2017-18,2018-04-03, Knicks,1610612752, Magic,1610612753
03/31/2018 Pistons at Knicks,21701139,2017-18,2018-03-31, Knicks,1610612752, Pistons,1610612765
03/28/2018 Knicks at 76ers,21701118,2017-18,2018-03-28, 76ers,1610612755, Knicks,1610612752
03/26/2018 Knicks at Hornets,21701103,2017-18,2018-03-26, Hornets,1610612766, Knicks,1610612752
03/25/2018 Knicks at Wizards,21701098,2017-18,2018-03-25, Wizards,1610612764, Knicks,1610612752
03/17/2018 Hornets at Knicks,21701038,2017-18,2018-03-17, Knicks,1610612752, Hornets,1610612766
03/15/2018 76ers at Knicks,21701022,2017-18,2018-03-15, Knicks,1610612752, 76ers,1610612755
03/11/2018 Raptors at Knicks,21700992,2017-18,2018-03-11, Knicks,1610612752, Raptors,1610612761
03/06/2018 Knicks at Trail Blazers,21700962,2017-18,2018-03-06, Trail Blazers,1610612757, Knicks,1610612752
03/04/2018 Knicks at Kings,21700949,2017-18,2018-03-04, Kings,1610612758, Knicks,1610612752
02/22/2018 Knicks at Magic,21700868,2017-18,2018-02-22, Magic,1610612753, Knicks,1610612752
02/14/2018 Wizards at Knicks,21700857,2017-18,2018-02-14, Knicks,1610612752, Wizards,1610612764
02/12/2018 Knicks at 76ers,21700842,2017-18,2018-02-12, 76ers,1610612755, Knicks,1610612752
02/11/2018 Knicks at Pacers,21700836,2017-18,2018-02-11, Pacers,1610612754, Knicks,1610612752
02/08/2018 Knicks at Raptors,21700812,2017-18,2018-02-08, Raptors,1610612761, Knicks,1610612752
01/26/2018 Knicks at Suns,21700723,2017-18,2018-01-26, Suns,1610612756, Knicks,1610612752
01/19/2018 Knicks at Jazz,21700672,2017-18,2018-01-19, Jazz,1610612762, Knicks,1610612752
01/17/2018 Knicks at Grizzlies,21700658,2017-18,2018-01-17, Grizzlies,1610612763, Knicks,1610612752
01/03/2018 Knicks at Wizards,21700556,2017-18,2018-01-03, Wizards,1610612764, Knicks,1610612752
01/02/2018 Spurs at Knicks,21700550,2017-18,2018-01-02, Knicks,1610612752, Spurs,1610612759
12/28/2017 Knicks at Spurs,21700519,2017-18,2017-12-28, Spurs,1610612759, Knicks,1610612752
12/25/2017 76ers at Knicks,21700493,2017-18,2017-12-25, Knicks,1610612752, 76ers,1610612755
12/22/2017 Knicks at Pistons,21700471,2017-18,2017-12-22, Pistons,1610612765, Knicks,1610612752
12/18/2017 Knicks at Hornets,21700441,2017-18,2017-12-18, Hornets,1610612766, Knicks,1610612752
12/16/2017 Thunder at Knicks,21700431,2017-18,2017-12-16, Knicks,1610612752, Thunder,1610612760
12/06/2017 Grizzlies at Knicks,21700357,2017-18,2017-12-06, Knicks,1610612752, Grizzlies,1610612763
12/04/2017 Knicks at Pacers,21700340,2017-18,2017-12-04, Pacers,1610612754, Knicks,1610612752
12/03/2017 Magic at Knicks,21700334,2017-18,2017-12-03, Knicks,1610612752, Magic,1610612753
11/27/2017 Trail Blazers at Knicks,21700293,2017-18,2017-11-27, Knicks,1610612752, Trail Blazers,1610612757
11/22/2017 Raptors at Knicks,21700258,2017-18,2017-11-22, Knicks,1610612752, Raptors,1610612761
11/17/2017 Knicks at Raptors,21700221,2017-18,2017-11-17, Raptors,1610612761, Knicks,1610612752
11/15/2017 Jazz at Knicks,21700206,2017-18,2017-11-15, Knicks,1610612752, Jazz,1610612762
11/11/2017 Kings at Knicks,21700179,2017-18,2017-11-11, Knicks,1610612752, Kings,1610612758
11/08/2017 Knicks at Magic,21700160,2017-18,2017-11-08, Magic,1610612753, Knicks,1610612752
11/07/2017 Hornets at Knicks,21700152,2017-18,2017-11-07, Knicks,1610612752, Hornets,1610612766
11/05/2017 Pacers at Knicks,21700142,2017-18,2017-11-05, Knicks,1610612752, Pacers,1610612754
11/03/2017 Suns at Knicks,21700124,2017-18,2017-11-03, Knicks,1610612752, Suns,1610612756
10/21/2017 Pistons at Knicks,21700030,2017-18,2017-10-21, Knicks,1610612752, Pistons,1610612765
10/19/2017 Knicks at Thunder,21700015,2017-18,2017-10-19, Thunder,1610612760, Knicks,1610612752
04/11/2018 Wizards at Magic,21701222,2017-18,2018-04-11, Magic,1610612753, Wizards,1610612764
04/08/2018 Magic at Raptors,21701200,2017-18,2018-04-08, Raptors,1610612761, Magic,1610612753
04/06/2018 Hornets at Magic,21701182,2017-18,2018-04-06, Magic,1610612753, Hornets,1610612766
03/24/2018 Suns at Magic,21701090,2017-18,2018-03-24, Magic,1610612753, Suns,1610612756
03/22/2018 76ers at Magic,21701073,2017-18,2018-03-22, Magic,1610612753, 76ers,1610612755
03/20/2018 Raptors at Magic,21701058,2017-18,2018-03-20, Magic,1610612753, Raptors,1610612761
03/13/2018 Magic at Spurs,21701012,2017-18,2018-03-13, Spurs,1610612759, Magic,1610612753
03/09/2018 Magic at Kings,21700985,2017-18,2018-03-09, Kings,1610612758, Magic,1610612753
03/05/2018 Magic at Jazz,21700955,2017-18,2018-03-05, Jazz,1610612762, Magic,1610612753
03/03/2018 Grizzlies at Magic,21700936,2017-18,2018-03-03, Magic,1610612753, Grizzlies,1610612763
03/02/2018 Pistons at Magic,21700926,2017-18,2018-03-02, Magic,1610612753, Pistons,1610612765
02/28/2018 Raptors at Magic,21700914,2017-18,2018-02-28, Magic,1610612753, Raptors,1610612761
02/26/2018 Magic at Thunder,21700903,2017-18,2018-02-26, Thunder,1610612760, Magic,1610612753
02/24/2018 Magic at 76ers,21700884,2017-18,2018-02-24, 76ers,1610612755, Magic,1610612753
02/14/2018 Hornets at Magic,21700854,2017-18,2018-02-14, Magic,1610612753, Hornets,1610612766
02/03/2018 Wizards at Magic,21700778,2017-18,2018-02-03, Magic,1610612753, Wizards,1610612764
01/27/2018 Magic at Pacers,21700725,2017-18,2018-01-27, Pacers,1610612754, Magic,1610612753
01/23/2018 Kings at Magic,21700696,2017-18,2018-01-23, Magic,1610612753, Kings,1610612758
01/12/2018 Magic at Wizards,21700620,2017-18,2018-01-12, Wizards,1610612764, Magic,1610612753
12/28/2017 Pistons at Magic,21700516,2017-18,2017-12-28, Magic,1610612753, Pistons,1610612765
12/23/2017 Magic at Wizards,21700483,2017-18,2017-12-23, Wizards,1610612764, Magic,1610612753
12/17/2017 Magic at Pistons,21700438,2017-18,2017-12-17, Pistons,1610612765, Magic,1610612753
12/15/2017 Trail Blazers at Magic,21700420,2017-18,2017-12-15, Magic,1610612753, Trail Blazers,1610612757
12/04/2017 Magic at Hornets,21700339,2017-18,2017-12-04, Hornets,1610612766, Magic,1610612753
11/29/2017 Thunder at Magic,21700304,2017-18,2017-11-29, Magic,1610612753, Thunder,1610612760
11/27/2017 Magic at Pacers,21700290,2017-18,2017-11-27, Pacers,1610612754, Magic,1610612753
11/25/2017 Magic at 76ers,21700278,2017-18,2017-11-25, 76ers,1610612755, Magic,1610612753
11/20/2017 Pacers at Magic,21700243,2017-18,2017-11-20, Magic,1610612753, Pacers,1610612754
11/18/2017 Jazz at Magic,21700229,2017-18,2017-11-18, Magic,1610612753, Jazz,1610612762
11/15/2017 Magic at Trail Blazers,21700213,2017-18,2017-11-15, Trail Blazers,1610612757, Magic,1610612753
11/10/2017 Magic at Suns,21700174,2017-18,2017-11-10, Suns,1610612756, Magic,1610612753
11/01/2017 Magic at Grizzlies,21700112,2017-18,2017-11-01, Grizzlies,1610612763, Magic,1610612753
10/29/2017 Magic at Hornets,21700088,2017-18,2017-10-29, Hornets,1610612766, Magic,1610612753
10/27/2017 Spurs at Magic,21700071,2017-18,2017-10-27, Magic,1610612753, Spurs,1610612759
04/10/2018 Hornets at Pacers,21701213,2017-18,2018-04-10, Pacers,1610612754, Hornets,1610612766
04/08/2018 Pacers at Hornets,21701197,2017-18,2018-04-08, Hornets,1610612766, Pacers,1610612754
04/06/2018 Pacers at Raptors,21701187,2017-18,2018-04-06, Raptors,1610612761, Pacers,1610612754
03/29/2018 Pacers at Kings,21701127,2017-18,2018-03-29, Kings,1610612758, Pacers,1610612754
03/17/2018 Pacers at Wizards,21701035,2017-18,2018-03-17, Wizards,1610612764, Pacers,1610612754
03/15/2018 Raptors at Pacers,21701020,2017-18,2018-03-15, Pacers,1610612754, Raptors,1610612761
03/13/2018 Pacers at 76ers,21701005,2017-18,2018-03-13, 76ers,1610612755, Pacers,1610612754
03/07/2018 Jazz at Pacers,21700965,2017-18,2018-03-07, Pacers,1610612754, Jazz,1610612762
03/04/2018 Pacers at Wizards,21700945,2017-18,2018-03-04, Wizards,1610612764, Pacers,1610612754
02/05/2018 Wizards at Pacers,21700791,2017-18,2018-02-05, Pacers,1610612754, Wizards,1610612764
02/03/2018 76ers at Pacers,21700777,2017-18,2018-02-03, Pacers,1610612754, 76ers,1610612755
02/02/2018 Pacers at Hornets,21700766,2017-18,2018-02-02, Hornets,1610612766, Pacers,1610612754
01/31/2018 Grizzlies at Pacers,21700753,2017-18,2018-01-31, Pacers,1610612754, Grizzlies,1610612763
01/29/2018 Hornets at Pacers,21700738,2017-18,2018-01-29, Pacers,1610612754, Hornets,1610612766
01/24/2018 Suns at Pacers,21700703,2017-18,2018-01-24, Pacers,1610612754, Suns,1610612756
01/21/2018 Pacers at Spurs,21700686,2017-18,2018-01-21, Spurs,1610612759, Pacers,1610612754
01/18/2018 Pacers at Trail Blazers,21700666,2017-18,2018-01-18, Trail Blazers,1610612757, Pacers,1610612754
01/15/2018 Pacers at Jazz,21700647,2017-18,2018-01-15, Jazz,1610612762, Pacers,1610612754
01/14/2018 Pacers at Suns,21700636,2017-18,2018-01-14, Suns,1610612756, Pacers,1610612754
12/26/2017 Pacers at Pistons,21700498,2017-18,2017-12-26, Pistons,1610612765, Pacers,1610612754
12/15/2017 Pistons at Pacers,21700419,2017-18,2017-12-15, Pacers,1610612754, Pistons,1610612765
